timestamp,tweet_text,username,all_hashtags,followers_count2020-12-06 02:26:00,Retweet selected by the https://t.co/11ojAZA3Wf team |  This Android App Will Show You if Your Smartphone Camera is Spying on You #technology https://t.co/oXkpOOIJh0 https://t.co/7rbPxF7CDA,GFACCORD,['technology'],10178
2020-12-06 02:25:59,"Top story: @FrRonconi: '#Drone taxis are a reality in #China! 🇨🇳 via @jblefevre60   #AI #MachineLearning #Robotics #Drones  @alvinfoo @chboursin @mvollmer1 @NevilleGaunt @JeroenBartelse @PawlowskiMario @MargaretSiegie… https://t.co/qnjUtikaDE, see more https://t.co/xSlmtgoNRZ",VisualSuccess,"['Drone', 'China', 'AI', 'MachineLearning', 'Robotics', 'Drones']",4153
2020-12-06 02:25:53,"💻 Start Your Freelance Journey in Information Technology with WorkBoxHub  🔍 Find a wide range of IT Projects @WorkBoxHub1   🔗 Register Now, Visit - https://t.co/jFF30Cjtdw  #freelance #freelancejobs #workboxhub #technology #virtualassistant #workfromhome #freelancingplatform https://t.co/CwSGIKoPGS",WorkBoxHub1,"['freelance', 'freelancejobs', 'workboxhub', 'technology', 'virtualassistant', 'workfromhome', 'freelancingplatform']",24
2020-12-06 02:25:14,"There’s a lot of hype about #AI but many people are vague on the answers to questions that matter: ‘what is AI’ and ‘what does it mean to my business’? AI expert, Kasia Borowska, broke it down for us: https://t.co/1XZwER9aaF #automation https://t.co/7nxtM2Zjx1",ShirewireGSD,"['AI', 'automation']",21
2020-12-06 02:24:46,It's a Perfect #Robot 🤩 See Full Video 😁 Really Like a real One https://t.co/FKBA8N55a0,IshanWankhade,['Robot'],1149
2020-12-06 02:23:57,Not a Cowboys fan but this is one of the coolest things I've seen in a stadium. #Cowboys #AI https://t.co/QKTpfwWuOw,BillyAshJR,"['Cowboys', 'AI']",1496
2020-12-06 02:23:55,@DJ_Teaze SaTurDaZe LuV  #King #KingOfKingZ #Primo #AboveTheRest #Empire #Legend #ActionbeforeWords #leo♌ #leo #Team #Leader #LeadNotFollow 🦁#DjTeaze #LaRazasDj #TheLowriderDj #DjTeazeSaturdazeLuv https://t.co/QLaNEqOqlO,DJ_Teaze,"['King', 'KingOfKingZ', 'Primo', 'AboveTheRest', 'Empire', 'Legend', 'ActionbeforeWords', 'leo', 'leo', 'Team', 'Leader', 'LeadNotFollow', 'DjTeaze', 'LaRazasDj', 'TheLowriderDj', 'DjTeazeSaturdazeLuv']",195
2020-12-06 02:23:54,Made the switch to #EV 🚗 ⚡️,milesfl0,['EV'],1113
2020-12-06 02:23:52,Machine Learning: 4 Books in 1: Basic Concepts + Artificial Intelligence + Python Programming + Python Machine Learning  Link - https://t.co/1Wc9tyO5y5  #MachineLearning #ML #Python #CodeNewbies #DataScience #DeepLearning #Robotics #programming #AI #ArtificialIntelligence,rasangarocks,"['MachineLearning', 'ML', 'Python', 'CodeNewbies', 'DataScience', 'DeepLearning', 'Robotics', 'programming', 'AI', 'ArtificialIntelligence']",50861
2020-12-06 02:23:18,"""You have a nice cock"" Tee $19.99 https://t.co/p2alIQ0M0l #memes #meme #dankmemes #funny #memesdaily #funnymemes #follow #love #lol #like #humor #instagram #tiktok #ol #dank #comedy #viral #dailymemes #fun #explorepage #instagood #bhfyp #followforfollowback #music #memepage https://t.co/bMz5Lq0hrt",mot1v8yourself,"['memes', 'meme', 'dankmemes', 'funny', 'memesdaily', 'funnymemes', 'follow', 'love', 'lol', 'like', 'humor', 'instagram', 'tiktok', 'ol', 'dank', 'comedy', 'viral', 'dailymemes', 'fun', 'explorepage', 'instagood', 'bhfyp', 'followforfollowback', 'music', 'memepage']",10
2020-12-06 02:23:10,[Job] Mechanical Engineer | Company: Eaton | Location: Sincan T06  Turkey | #Sincan #Mechanical #Engineering #Jobs | More info at  https://t.co/ZbUH2wb69s,EngineersDay,"['Sincan', 'Mechanical', 'Engineering', 'Jobs']",16143
2020-12-06 02:22:56,[Job] Wind Mechanical Technician | Company: FieldCore | Location: Izmir T35  Turkey | #Izmir #Mechanical #Engineering #Jobs | More info at  https://t.co/knaH2gA8hV,EngineersDay,"['Izmir', 'Mechanical', 'Engineering', 'Jobs']",16143
2020-12-06 02:22:45,Sphere forming by explosion.   The easiest and fastest way from frustum to sphere!  #Engineering https://t.co/VHivTMWqvY,ersuniverse,['Engineering'],17016
2020-12-06 02:22:37,[Job] Mechanical Engineer | Company: Skyborn Robotics | Location: Izmir T35  Turkey | #Izmir #Mechanical #Engineering #Jobs | More info at  https://t.co/81cvFFxkjY,EngineersDay,"['Izmir', 'Mechanical', 'Engineering', 'Jobs']",16143
2020-12-06 02:22:25,The S&amp;P 500 Could Surge To …  #ai #artificialintelligence #roboadvisor for #sp500 #spx https://t.co/4xnbGjwZzO,spxbot,"['ai', 'artificialintelligence', 'roboadvisor', 'sp500', 'spx']",73
2020-12-06 02:22:23,[Job] Investments and Maintenance Manager | Company: Weber | Location: Izmir T35  Turkey | #Izmir #Mechanical #Engineering #Jobs | More info at  https://t.co/stWRS9w7Yr,EngineersDay,"['Izmir', 'Mechanical', 'Engineering', 'Jobs']",16143
2020-12-06 02:22:19,It’s so true @svpino  The formal education changes the perspective both in professional life and in personal life. Continuous updating thereafter make your analysis strong and reasoning sound! #education #technology #Philosophy #leadership #Communication #innovation  #rm🌅 https://t.co/cazzdrrx1x,DrRakeshM,"['education', 'technology', 'Philosophy', 'leadership', 'Communication', 'innovation', 'rm']",593
2020-12-06 02:22:06,https://t.co/ZS5HXP6Grb Library - #Research regarding consciousness.   #AI #mentalhealth  https://t.co/AhX9BSnHwo,gaddes_t,"['Research', 'AI', 'mentalhealth']",374
2020-12-06 02:22:04,[Job] Mechanical Design Engineer-Robotics | Company: ABB | Location: Istanbul T34  Turkey | #Istanbul #Mechanical #Engineering #Jobs | More info at  https://t.co/2qxEyELGo0,EngineersDay,"['Istanbul', 'Mechanical', 'Engineering', 'Jobs']",16143
2020-12-06 02:21:56,I don’t like cars - I hate them and feed them https://t.co/n01bTXLb4W  @gillespeterson #cars #petrol #music,simonoxleee,"['cars', 'petrol', 'music']",1609
2020-12-06 02:21:50,[Job] Work Area Coordinator M/F | Company: Assystem | Location: Içel T33  Turkey | #Içel #Mechanical #Engineering #Jobs | More info at  https://t.co/RBAX6gEj4g,EngineersDay,"['Içel', 'Mechanical', 'Engineering', 'Jobs']",16143
2020-12-06 02:21:43,Master Remote Work and Productivity with the Elgato Stream Deck https://t.co/0xY1B5vy89 #Elgato #Streamdeck #gaming #remotework #covid #pandemic #gadget #technology,waleedo0,"['Elgato', 'Streamdeck', 'gaming', 'remotework', 'covid', 'pandemic', 'gadget', 'technology']",209
2020-12-06 02:21:37,[Job] Mechanical Maintenance Supervisor | Company: PepsiCo | Location: Içel T33  Turkey | #Içel #Mechanical #Engineering #Jobs | More info at  https://t.co/Cj2fvtv6V6,EngineersDay,"['Içel', 'Mechanical', 'Engineering', 'Jobs']",16143
2020-12-06 02:21:32,"@MSNBC @KenDilanianNBC This is the stuff of the most nightmarish #sciencefiction, &amp; deeply troubling. It has the potential to cause a ghastly kind of arms race, entailing militarily-directed #Engineering of the #Human genome.",RMBlaber56,"['sciencefiction', 'Engineering', 'Human']",193
2020-12-06 02:21:25,1/144 HG Me02R-F01 Messer Type-F01 Been slowly working on the Messer kit while filming it for my first YouTube video . https://t.co/cLuoQaWGto   #gundam #gunpla #robot #anime #japan #mecha #Bandai #Gundam  #건담 #Gundam #hobby  #gunplaworkz #ガンプラ #dspiae #messer https://t.co/LLqhKiTIQf,gunplaworkz,"['gundam', 'gunpla', 'robot', 'anime', 'japan', 'mecha', 'Bandai', 'Gundam', '건담', 'Gundam', 'hobby', 'gunplaworkz', 'ガンプラ', 'dspiae', 'messer']",504
2020-12-06 02:21:25,[Job] Mechanical Engineer | Company: EKODENGE | Location: Ankara T06  Turkey | #Ankara #Mechanical #Engineering #Jobs | More info at  https://t.co/JN3Jh8g1HA,EngineersDay,"['Ankara', 'Mechanical', 'Engineering', 'Jobs']",16143
2020-12-06 02:21:12,We remain available to assist you in finding your path! Text LOYALTY to 462769 (GOARMY) or click the link in our bio.  GO ARMY beat navy!  #joinUS #warriors #USArmy #team #soldiers #CalltoServe #answerthecal #teameaglecdr https://t.co/ry2QbDjMB8,ArmyTeamRoswell,"['joinUS', 'warriors', 'USArmy', 'team', 'soldiers', 'CalltoServe', 'answerthecal', 'teameaglecdr']",1
2020-12-06 02:21:11,We remain available to assist you in finding your path! Text LOYALTY to 462769 (GOARMY) or click the link in our bio.  GO ARMY beat navy!  #joinUS #warriors #USArmy #team #soldiers #CalltoServe #answerthecal #teameaglecdr https://t.co/ZdEjmtCrmY,ArmyTeamAtlanta,"['joinUS', 'warriors', 'USArmy', 'team', 'soldiers', 'CalltoServe', 'answerthecal', 'teameaglecdr']",118
2020-12-06 02:21:10,How #IoT Is Revolutionising The Supply Chain The Internet of Things (#IoT) refers to a system of internet-connected objects that collect and tra .. https://t.co/kVxQHudBRr #Analytics #datagovernance  https://t.co/qVs5GZkif1,biconnections,"['IoT', 'IoT', 'Analytics', 'datagovernance']",65908
2020-12-06 02:21:04,We remain available to assist you in finding your path! Text LOYALTY to 462769 (GOARMY) or click the link in our bio.  GO ARMY beat navy!  #joinUS #warriors #USArmy #team #soldiers #CalltoServe #answerthecal #teameaglecdr https://t.co/e8zvUwj3kf,TeamMidtownATL,"['joinUS', 'warriors', 'USArmy', 'team', 'soldiers', 'CalltoServe', 'answerthecal', 'teameaglecdr']",1
2020-12-06 02:20:59,We remain available to assist you in finding your path! Text LOYALTY to 462769 (GOARMY) or click the link in our bio.  GO ARMY beat navy!  #joinUS #warriors #USArmy #team #soldiers #CalltoServe #answerthecal #teameaglecdr https://t.co/uh24RKwKyS,ArmyJonesboro,"['joinUS', 'warriors', 'USArmy', 'team', 'soldiers', 'CalltoServe', 'answerthecal', 'teameaglecdr']",1
2020-12-06 02:20:49,We remain available to assist you in finding your path! Text LOYALTY to 462769 (GOARMY) or click the link in our bio.  GO ARMY beat navy!  #joinUS #warriors #USArmy #team #soldiers #CalltoServe #answerthecal #teameaglecdr https://t.co/KxHwXSN8gy,ATLawrenceville,"['joinUS', 'warriors', 'USArmy', 'team', 'soldiers', 'CalltoServe', 'answerthecal', 'teameaglecdr']",3
2020-12-06 02:20:44,We remain available to assist you in finding your path! Text LOYALTY to 462769 (GOARMY) or click the link in our bio.  GO ARMY beat navy!  #joinUS #warriors #USArmy #team #soldiers #CalltoServe #answerthecal #teameaglecdr https://t.co/pbSsi0nHFR,ArmyTeamDuluth,"['joinUS', 'warriors', 'USArmy', 'team', 'soldiers', 'CalltoServe', 'answerthecal', 'teameaglecdr']",1
2020-12-06 02:20:43,We remain available to assist you in finding your path! Text LOYALTY to 462769 (GOARMY) or click the link in our bio.  GO ARMY beat navy!  #joinUS #warriors #USArmy #team #soldiers #CalltoServe #answerthecal #teameaglecdr https://t.co/oJjYTtgyUn,ArmyTeamDeKalb,"['joinUS', 'warriors', 'USArmy', 'team', 'soldiers', 'CalltoServe', 'answerthecal', 'teameaglecdr']",1
2020-12-06 02:20:12,"According to a study by Forrester, there’s no single connectivity option that meets every use case for #IoT. Orgs should expect to navigate a landscape that includes standards like public/private #5G, #WiFi and even satellites to make deployments work. https://t.co/sCnU3M53ts",GHATechnologies,"['IoT', '5G', 'WiFi']",759
2020-12-06 02:20:11,"January, February, March 2021 = New climate, new speed, new application, new laws.  #December2020 #astrology #technology #astrobot #doityourself #home #lifestyle #ClimateAction  #prevention  #trends #Speed #newspeed #newapp #new #ClimateEmergency",HandeEdremit,"['December2020', 'astrology', 'technology', 'astrobot', 'doityourself', 'home', 'lifestyle', 'ClimateAction', 'prevention', 'trends', 'Speed', 'newspeed', 'newapp', 'new', 'ClimateEmergency']",64
2020-12-06 02:20:06,It’s Saturday night. Do you make your dog keep up with your ambition?👱🏽‍♀️ here we are watching @BenjaminPring @michelegoetz @bretgreenstein @dcaiazza discuss how leaders use #ai to adapt their organizations—#futureofwork https://t.co/gvp4gbr0DV,JViccarro,"['ai', 'futureofwork']",91
2020-12-06 02:20:02,"Registered #COLING2020 attendees!   Join us for the first of many fun @coling2020 social events! 🎉  Visit our Main Stage 12/8 at 19:00 (CET) for “Queer in AI”, at @COLING2020!   https://t.co/ZucASntnnK  #underlinescience #AI #virtualconference #ArtificialIntelligence #LBGTQ https://t.co/TBdSF3bZf9",underlineio,"['COLING2020', 'underlinescience', 'AI', 'virtualconference', 'ArtificialIntelligence', 'LBGTQ']",1625
2020-12-06 02:20:02,This #robot can detect when store customers aren’t wearing #facemasks 😷 🤖 #Robotics #futureofwork #innovation  V/@nowthisnews cc:@PawlowskiMario @Maperez324 @TheNathanOne @steffanoferrari @enricomolinari @HaroldSinnott @MargaretSiegien    https://t.co/ikOaQGtWDG,MargaretSiegien,"['robot', 'facemasks', 'Robotics', 'futureofwork', 'innovation']",6049
2020-12-06 02:19:55,Full-Featured HexEditor new release! Added assembler/disassembler functions using Capstone an... https://t.co/WlyfTrnBc2 #programming #softwareengineering #bigdata #datascience #analytics #ai #python #javascript,GavLaaaaaaaa,"['programming', 'softwareengineering', 'bigdata', 'datascience', 'analytics', 'ai', 'python', 'javascript']",7184
2020-12-06 02:19:23,Maybe the first time I have ever been jealous of @IndianaFootball .  @CoachAllenIU has a fan in me!  #Team #IU #Hoosiers https://t.co/fi0O8e5kY1,judgeschmelz,"['Team', 'IU', 'Hoosiers']",205
2020-12-06 02:19:16,Top 3 (low form) WERRIBEE (01) 8. STEEL SEDAKA 73% 9. PRIDE OF KINROSS (NZ) 27% 7. STAR INES 0% #Au #Racing #Tips,BetBotAu,"['Au', 'Racing', 'Tips']",438
2020-12-06 02:19:10,"TMT continues to lead in data maturity and improved its index score by 15%, but the energy and industrial goods demonstrated the highest upswing, possibly driven by the growth of IoT data in those sectors.  Source @BCG Link&gt;&gt; https://t.co/qoZB6GR6vH via @antgrasso #BigData #IoT https://t.co/FHwOvb2zSv",TheDigitalEcos,"['BigData', 'IoT']",8296
2020-12-06 02:18:00,Outside temperature is -7.8. #RandomStat #IOT #SmartHome,UnbornXHA,"['RandomStat', 'IOT', 'SmartHome']",149
2020-12-06 02:17:59,Retweet selected by the https://t.co/11ojAZA3Wf team |  AUSA 2020: John Cockerill signs agreement with US Army to develop medium caliber weapon system #technology https://t.co/P29fDMSpw7 https://t.co/45ujOW5hzQ,GFACCORD,['technology'],10178
2020-12-06 02:17:53,These Middle School Ballers accounted for 3 TDs today 🙌  #DT7v7 #FUTURE @Samoako29 https://t.co/U8GxXbSuTQ,DT7v7,"['DT7v7', 'FUTURE']",228
2020-12-06 02:17:35,An artistic look at Data #BigData #AI #MachineLearning #DeepLearning #Analytics #Statistics #DataViz #DataLiteracy #DataStorytelling #Algorithms #visualthinking #visualization https://t.co/POCxv2b2MI,4th_turning,"['BigData', 'AI', 'MachineLearning', 'DeepLearning', 'Analytics', 'Statistics', 'DataViz', 'DataLiteracy', 'DataStorytelling', 'Algorithms', 'visualthinking', 'visualization']",650
2020-12-06 02:16:56,IND vs AUS 2nd T20 Analysis out now  #likes #like #follow #likeforlikes #love #followforfollowback #instagood #instagram #followme #photooftheday #l #instalike #bhfyp #photography #instadaily #likeforfollow #me #picoftheday #beautiful #followers #myself  https://t.co/1DlWat70th,HattrikkSanjith,"['likes', 'like', 'follow', 'likeforlikes', 'love', 'followforfollowback', 'instagood', 'instagram', 'followme', 'photooftheday', 'l', 'instalike', 'bhfyp', 'photography', 'instadaily', 'likeforfollow', 'me', 'picoftheday', 'beautiful', 'followers', 'myself']",12
2020-12-06 02:16:21,"Top story today  @FrRonconi: '#Drone taxis are a reality in #China! 🇨🇳 via @jblefevre60   #AI #MachineLearning #Robotics #Drones  @alvinfoo @chboursin @mvollmer1 @NevilleGaunt @JeroenBartelse @PawlowskiMario @Margaret… https://t.co/uvpg694YGL, see more https://t.co/Q12gOOlQF2",JeromeMONANGE,"['Drone', 'China', 'AI', 'MachineLearning', 'Robotics', 'Drones']",7947
2020-12-06 02:16:14,How Is Artificial Intelligence Used In B2B Companies: Here Are Powerful Examples https://t.co/zaRk5OHjFB #ai,RachelHarriet_,['ai'],1524
2020-12-06 02:16:00,ONC seeks to standardize patient addresses with new Project US@ https://t.co/W6r4Z6Zi1U #healthcare #healthcareIT #informatics #technology #news,PharmacyITMe,"['healthcare', 'healthcareIT', 'informatics', 'technology', 'news']",1036
2020-12-06 02:15:42,"🌌 The universe is made of protons, neutrons, electrons, &amp; morons 👉 https://t.co/b1B2zZqolI  #universe #morons #science #consciousness #energy #space #cosmos #wisdom #stupidpeople #idiocy #lol #stem #education #astronomy #technology #fun #jokes #funnyshit #laugh #lmao #offensive https://t.co/8wopuZ7AgZ",peaktee,"['universe', 'morons', 'science', 'consciousness', 'energy', 'space', 'cosmos', 'wisdom', 'stupidpeople', 'idiocy', 'lol', 'stem', 'education', 'astronomy', 'technology', 'fun', 'jokes', 'funnyshit', 'laugh', 'lmao', 'offensive']",23
2020-12-06 02:15:17,"December 06, 2020 at 07:45AM I just remind you to check out our business website at https://t.co/YnwnW59SIu and you may be surprised. #technology #india #ondemandapps https://t.co/IksEwTlrGk",insinew,"['technology', 'india', 'ondemandapps']",19
2020-12-06 02:15:14,"Can you tell the #future without a #psychic? You can, with #numerology. Get a FREE personalized report here: https://t.co/AYNjTqILQ4 https://t.co/6F7ubIYyl1",NumbersDecoded,"['future', 'psychic', 'numerology']",236
2020-12-06 02:14:30,Top 3 (low form) NOWRA (01) 3. MISS KEIRA 92% 1. AMUNGEE 7% 9. JOLIE COLLEEN 0% #Au #Racing #Tips,BetBotAu,"['Au', 'Racing', 'Tips']",438
2020-12-06 02:13:54,Driving remote workforce efficiency with IoT security https://t.co/6BUMSHEAos #ai,KKing_Creative,['ai'],1390
2020-12-06 02:13:33,"How to Enable Full-Screen Incoming Calls on iPhone: Ever since the iPhone launched, an incoming call would take up the entire screen. But if you’re running iOS 14 or higher, you’ll see a banner style for incoming calls. Here’s… https://t.co/nrkM0wzqjl #news #technews #technology https://t.co/Bh0z3sdHyl",TechFishNews,"['news', 'technews', 'technology']",3122
2020-12-06 02:13:32,Artificial Intelligence – the new season is out - Jordan Times: Artificial Intelligence – the new season is out  Jordan Times https://t.co/YimphymsJ1 #AI #artificialintelligence #Finperform,SuriyaSubraman,"['AI', 'artificialintelligence', 'Finperform']",4611
2020-12-06 02:13:20,"7 and a long time. Finally it needed  Don't do any strange and hours here with sacrifice or lucky the as for you  and your work of wine is worried with the very real consequer,  the cock grabbing the star who will  no walk away from your type into a can.  #ai #poem #man",NeuralPoet,"['ai', 'poem', 'man']",217
2020-12-06 02:13:14,Compact LED WiFi Projector #wireless #future https://t.co/IJ0HhNgRtS https://t.co/aZGmCqYkao,techie_heads,"['wireless', 'future']",10
2020-12-06 02:13:05,"Artificial Intelligence, Machine Learning To Play an important Role In Fight Against COVID, Say … -  https://t.co/qsQiFRWA8i #ai #intoAInews",into_AI,"['ai', 'intoAInews']",19384
2020-12-06 02:13:02,CAPTAIN POWER - All T-Shirts $14 @TeePublic  #CYBERWEEK SALE An 80s TV Classic: https://t.co/jNmms95nGl   #tshirt #sweatshirt #longsleeve #mask #hoodie #geek #nerd #Xmas #xmasgift #xmas2020 #captainpower #phoenix #captainpowerandthesoldiersofthefuture #digital #future #80s https://t.co/7CeRFzanyg,cine31,"['CYBERWEEK', 'tshirt', 'sweatshirt', 'longsleeve', 'mask', 'hoodie', 'geek', 'nerd', 'Xmas', 'xmasgift', 'xmas2020', 'captainpower', 'phoenix', 'captainpowerandthesoldiersofthefuture', 'digital', 'future', '80s']",1528
2020-12-06 02:12:52,Advanced Artificial Intelligence Adopters Attributed 12% Points of Revenue Gain Directly to AI … -  https://t.co/16hHnSd6co #ai #intoAInews,into_AI,"['ai', 'intoAInews']",19384
2020-12-06 02:12:48,Cylance brings AI and machine learning to anti-virus protection - Their new world order weaponiz https://t.co/EvJlzIybku #ai #intoAInews,into_AI,"['ai', 'intoAInews']",19384
2020-12-06 02:12:43,"Just facilitated the sale of my first @Porsche Taycan  A close friend was considering a $TSLA Model S, but I convinced him to try the Taycan &amp; E-Tron. Today he pulled the trigger on his first #EV, the Porsche Taycan 4s  I've sold Teslas years ago, but now there are better options https://t.co/pNbOtQ4ryf",GreatPaul_Smith,['EV'],199
2020-12-06 02:12:35,@canibalsnyc ON NOW! https://t.co/3oevqi0z1x #Livestream #metal #music #metalcore #gabber #punkrock #metal #rock #metalhead #heavymetal #guitar #metalmusic #metalcore #hardrock #punk #guitarist #metalheads #band #metalband #rocknroll #goth #metalgirl #concert #hardcore #bhfyp,fourthmedianyc,"['Livestream', 'metal', 'music', 'metalcore', 'gabber', 'punkrock', 'metal', 'rock', 'metalhead', 'heavymetal', 'guitar', 'metalmusic', 'metalcore', 'hardrock', 'punk', 'guitarist', 'metalheads', 'band', 'metalband', 'rocknroll', 'goth', 'metalgirl', 'concert', 'hardcore', 'bhfyp']",178
2020-12-06 02:12:09,Survey: Low-code tools and application development will be responsible for more than 65% of #App development activity by 2024. https://t.co/lapyu9sRrG   @SingingInDCloud @alison_iot @ajb338 @LostInDigit @FeedSupervised  #Innovation #RemoteWork #Automation #AI #Python #ML https://t.co/ZwHPfno7Uh,stratorob,"['App', 'Innovation', 'RemoteWork', 'Automation', 'AI', 'Python', 'ML']",31967
2020-12-06 02:11:59,"""International expansion is a matter of focus, as well as financial resources. #technology #tech #news"" https://t.co/xi41jOK4PW",BenefitsMind,"['technology', 'tech', 'news']",225
2020-12-06 02:11:54,Stylish phone cases available on TeePublic #teepublic #technology #Accessories #phonecase #phonecases #printed #design #artwork #art #blogger #blog #blogpost #supportsmallbusiness https://t.co/MzcZ6twlxX,ismasaleem,"['teepublic', 'technology', 'Accessories', 'phonecase', 'phonecases', 'printed', 'design', 'artwork', 'art', 'blogger', 'blog', 'blogpost', 'supportsmallbusiness']",1559
2020-12-06 02:11:44,This #Robot Can Rap--Really https://t.co/qoEkAXmWuc via @sciam #robots,theSVstory,"['Robot', 'robots']",1461
2020-12-06 02:11:15,"#AI #ArtificialIntelligence #ML @rvp -  Google widely criticized after parting ways with a leading voice in AI ethics  - CNN https://t.co/1YwLqiP09n, see more https://t.co/dUDn89WPPF",rvp,"['AI', 'ArtificialIntelligence', 'ML']",4072
2020-12-06 02:11:02,$KULR We’re bringing the next generation of technology  https://t.co/5xADOhoQE3 #Technology #wsj #nytimes #business #reuters #IHub_StockPosts #forbes #marketwatch #cnn #bet #foxnews #latimes #usatoday #investiingcom #barronsonline #TheEconomist #IBDinvestors #cnnmoneyinvest #wgn https://t.co/DI5rrYDTJO,medianycity,"['Technology', 'wsj', 'nytimes', 'business', 'reuters', 'IHub_StockPosts', 'forbes', 'marketwatch', 'cnn', 'bet', 'foxnews', 'latimes', 'usatoday', 'investiingcom', 'barronsonline', 'TheEconomist', 'IBDinvestors', 'cnnmoneyinvest', 'wgn']",8619
2020-12-06 02:10:52,"Great story @bgarrettglaser. This is what happens (likely to happen) when real #business meets #tech hype: portfolios are trimmed for #profitability. Especially when complex #deep #technology &amp; #hardware are involved - &amp; you don't have the deep pockets of @Google, @amazon etc. https://t.co/z0XAeGb2ts",robertoalvarez,"['business', 'tech', 'profitability', 'deep', 'technology', 'hardware']",1156
2020-12-06 02:10:50,"The new game for tonight's stream is downloading right now! No surprises this time, Assetto Corsa coming up! Get ready for some clean lines and hot of the press mods baby! #Livestream #twitch #Racing",originalblaze2,"['Livestream', 'twitch', 'Racing']",8
2020-12-06 02:10:04,"Date: Saturday, December 05 21:10:03 2020 EST Uptime: 1 day CPU Temperature: 55.1 C Free Disk Space: 29% Memory Usage: 52.0% Load Avg: 0.20 0.14 0.10  Powered by #RaspberryPi #IoT #Maker",gpibot_g,"['RaspberryPi', 'IoT', 'Maker']",66
2020-12-06 02:10:03,The Force Awakens!o #lightsaber #d #thelastjedi #art #clonewars #riseofskywalker #lucasfilm #hansolo #bhfyp   #kyloren https://t.co/4coEPAHHlO #onlinegames https://t.co/6MlUqQ1Fav,gamesclips,"['lightsaber', 'd', 'thelastjedi', 'art', 'clonewars', 'riseofskywalker', 'lucasfilm', 'hansolo', 'bhfyp', 'kyloren', 'onlinegames']",1693
2020-12-06 02:10:02,What is Third-Party Risk Management?  https://t.co/BPbyzZet2C Source: @attcyber  #Cybersecurity #Technology,Cybersecinsider,"['Cybersecurity', 'Technology']",7205
2020-12-06 02:10:01,"Getting there: Structured data, semantics, robotics, and the future of #AI https://t.co/IJyHy9pHz5 via @ZDNet &amp; @linked_do",theSVstory,['AI'],1461
2020-12-06 02:08:55,The latest Voigt-Kampff Analyzer! https://t.co/0Em8dB4T4Z Thanks to @Rad1Sharif @revolvingdoorDC @barbarikon #ai #machinelearning,Treadstone71LLC,"['ai', 'machinelearning']",304017
2020-12-06 02:08:10,Let’s rebuild America’s infrastructure and boost state to state economies using #automation as the forefront.  . Pair this concept with a #GreenNewDeal structure and we can start the processes of heading in the right direction.  . #Manufacturing #Engineering #PortfolioDay https://t.co/aaJtX2NsKO,DEMCCORP1,"['automation', 'GreenNewDeal', 'Manufacturing', 'Engineering', 'PortfolioDay']",85
2020-12-06 02:08:10,What precautions did you take against energy cuts?  #December2020 #energy #ENERGYforYou #home #homemade #HomeAlone #doityourself #diy #ClimateAction #ClimateEmergency #energycut #electric #prevention #survived2020,HandeEdremit,"['December2020', 'energy', 'ENERGYforYou', 'home', 'homemade', 'HomeAlone', 'doityourself', 'diy', 'ClimateAction', 'ClimateEmergency', 'energycut', 'electric', 'prevention', 'survived2020']",64
