timestamp,tweet_text,username,all_hashtags,followers_count2020-12-06 00:46:32,Honda e Becomes First Japanese Vehicle to Win ‘German Car of the Year’; Adds to Growing Tally of Global Accolades https://t.co/1u3xQ6FDoQ #electricvehicles #renewableenergy #cleanenergy #ev #evnews #carbonfootprint #energy #sustainable,CraigTBouchard,"['electricvehicles', 'renewableenergy', 'cleanenergy', 'ev', 'evnews', 'carbonfootprint', 'energy', 'sustainable']",751
2020-12-06 00:45:53,How much do #ElectricVehicles REALLY cost?? #EV's will put #China in control of transportation (2 Chinese companies control 1/3 market in the #electricbatteries that power EVs!) https://t.co/6MWZsVH168,MattRSchaefer,"['ElectricVehicles', 'EV', 'China', 'electricbatteries']",2113
2020-12-06 00:45:02,How to Catch Payments Fraud with AI https://t.co/thpnz0K43T  #ArtificialIntelligence #AI #DataScience #MachineLearning  #DeepLearning #IoT #DataAnalytics #PredictiveAnalytics #BigData  #DataScientists,_asifbhat_,"['ArtificialIntelligence', 'AI', 'DataScience', 'MachineLearning', 'DeepLearning', 'IoT', 'DataAnalytics', 'PredictiveAnalytics', 'BigData', 'DataScientists']",1591
2020-12-06 00:45:01,Wish to reap the full benefits of your #EMR software??? Overcome these challenges first. @EHRIntel  https://t.co/RxWpzB6RQG  #EHR #EMR #healthcare #technology #workflow #efficiency #mhealth #DigitalHealth #healthIT #healthtech #ehealth #patientengagement https://t.co/tvcCIku5NZ,Medigy1,"['EMR', 'EHR', 'EMR', 'healthcare', 'technology', 'workflow', 'efficiency', 'mhealth', 'DigitalHealth', 'healthIT', 'healthtech', 'ehealth', 'patientengagement']",405
2020-12-06 00:45:00,Let us be #grateful to people who make us happy; they are the charming #gardeners who make our souls blossom. #MarcelProust #appreciationpost #happy #leader #Accounting #audit #ThinkBIGSundayWithMarsha #accountspayable #technology #fintech #motivation https://t.co/FtXlqpyHXJ,Accountspayable,"['grateful', 'gardeners', 'MarcelProust', 'appreciationpost', 'happy', 'leader', 'Accounting', 'audit', 'ThinkBIGSundayWithMarsha', 'accountspayable', 'technology', 'fintech', 'motivation']",2574
2020-12-06 00:44:28,A comedy skit discussion #video over #ai and how the possibilities of it making its way into the work force could transcend. Check out why by viewing it here: https://t.co/ugEt7sgure  #tech #science https://t.co/Q2xdoV8uTo,AntonioWestley,"['video', 'ai', 'tech', 'science']",14616
2020-12-06 00:44:16,Waiting for @JakeMendoza198 to get to the #underground #fortress under Las Venturas to stop these mad #scientists who are making people and #cars change #colours out of sudden. The IAA has successfully analysed the bacteria causing this in co-op with @FIB_GTAV https://t.co/Q3DsZzMRmt,EStrawberg,"['underground', 'fortress', 'scientists', 'cars', 'colours']",128
2020-12-06 00:43:56,"@mattmayo13 #AI, #Analytics, #MachineLearning, #DataScience, #DeepLearning in 2020 and Key Trends for 2021  https://t.co/DLw1L1WGgR",HadoxN,"['AI', 'Analytics', 'MachineLearning', 'DataScience', 'DeepLearning']",164
2020-12-06 00:43:33,A New #technology campaign! 'Tantrom: Pandemic Safe Dating' https://t.co/gtttAKdV2E #Tantrom:_Pandemic_Safe_Dating,CrowdCBoost,"['technology', 'Tantrom']",6612
2020-12-06 00:43:11,"Really enjoyed participating in the #insurtech panel on #AI in #insurance. Saw many familiar names among the participants, thank you all for support and some great questions! https://t.co/m7E537r8pU",FrankEijsink,"['insurtech', 'AI', 'insurance']",729
2020-12-06 00:42:40,"“Research findings are instructive for anyone wondering what life in an algorithmically dominated future might be like.”  Ugh. Nobody’s reading, but the machines.   Companies are now writing reports tailored for AI readers – and it should worry us  #AI  https://t.co/HoJJyZ2CBA",withazed,['AI'],1497
2020-12-06 00:42:16,XXXVI.  'T is the cloud of whole winds will come!  #ai #poem #winds,NeuralPoet,"['ai', 'poem', 'winds']",217
2020-12-06 00:42:07,"An Interview With John (Aka What TextSynth AI does when you ask it to generate text from this particular template sample.) The text in bold was the input, everything else the AI's output.  #ai #text #interview #normal https://t.co/XVBJEIEIg2",thetakuser,"['ai', 'text', 'interview', 'normal']",130
2020-12-06 00:42:01,Action for Egyptian Human Rights Defenders https://t.co/AlSaSPvMGi | #EFF #FreeSpeech #DigitalPrivacy #Tech #HighTech #Technology #Rights #Privacy @EFF,garypalmerjr,"['EFF', 'FreeSpeech', 'DigitalPrivacy', 'Tech', 'HighTech', 'Technology', 'Rights', 'Privacy']",5340
2020-12-06 00:41:55,"""The American food delivery unicorn now expects to debut at $90 to $95 per share, up from a previous range of $75 to $85. #technology #tech #news"" https://t.co/pmVkSqlP48",BenefitsMind,"['technology', 'tech', 'news']",225
2020-12-06 00:41:44,Check out this #technology campaign! 'No More Usernames and Passwords' https://t.co/xm9e3VpOZ6,CrowdCBoost,['technology'],6612
2020-12-06 00:41:43,Maturity model for #datalake Integration    #technology #architecture for  Landing zones #datascience env. Offload #datawarehouse Holistic #dataops   #ArtificialIntelligence #MachineLearning #BigData  #DeepLearning #DataCenter #Analytics #prodmgmt https://t.co/KDx6mUyjFO,BigBetAnalytics,"['datalake', 'technology', 'architecture', 'datascience', 'datawarehouse', 'dataops', 'ArtificialIntelligence', 'MachineLearning', 'BigData', 'DeepLearning', 'DataCenter', 'Analytics', 'prodmgmt']",317
2020-12-06 00:41:35,"I find nature and art inspiring. It brings us calmness, clarity, energy and encourages us to think differently in business, technology and life. A few photos I took today. #hope #photooftheday #technology #creativity #nature #beauty https://t.co/SDsAUnPgwB",kerinroberts,"['hope', 'photooftheday', 'technology', 'creativity', 'nature', 'beauty']",1010
2020-12-06 00:41:35,$ETH is a beast and is certainly gonna outperform $BTC in this bull cycle. I am pretty sure it will hit and surpass its ATH in 2021.    #BTC #cryptocurrencies #CryptoTwitter #Finance #halving #altcoins #future https://t.co/Qcx86yYHud,BigTradeCrypto,"['BTC', 'cryptocurrencies', 'CryptoTwitter', 'Finance', 'halving', 'altcoins', 'future']",22
2020-12-06 00:41:26,#Technology: Look to the fringes for the innovation that will shake up Big Tech https://t.co/x5IPWbQnfd,radoncnotes,['Technology'],314
2020-12-06 00:41:05,"@LimitingThe Jordan: UR right,🔋R complex Many moving parts incl.  What's happening @ cathode &amp; anode surfaces  .@AmazingChevVolt .@Txt_Mining .@inKenGray .@Shine_CZ   Have not had #AI, machine learning &amp; #IoT tools we needed     .@BW .@FT .@WSJ .@TilmanWinkler .@NuovaRealta .@alex_avoigt",ViRKL,"['AI', 'IoT']",780
2020-12-06 00:40:22,I just published Daily Crypto News | 05.12.2020 https://t.co/krWWeFY4cq   #Cryptocurrency #Money #Blockchain #Future,denizdozer,"['Cryptocurrency', 'Money', 'Blockchain', 'Future']",61
2020-12-06 00:40:21,"FAMILY of 5 now lives in this 3D printed home 🏡   🏠 Built in 2 days, 6 hrs 🏠 20% ⬇️ than traditional #construction @mashable   #3Dprinting #TechForGood #cities #HousingCrisis #SDGs #tech #IoT #smarthome   @ShiCooks @SDGS4GOOD @PawlowskiMario @AkwyZ   https://t.co/U3q9sYxHik",GlenGilmore,"['construction', '3Dprinting', 'TechForGood', 'cities', 'HousingCrisis', 'SDGs', 'tech', 'IoT', 'smarthome']",295845
2020-12-06 00:40:20,A New #technology campaign! 'MOJIETU Lightning-A Smart Cordless &amp; Portable Tire Inflator' https://t.co/uXPbgoaZ8Q,CrowdCBoost,['technology'],6612
2020-12-06 00:40:09,Huge drone set to launch satellites in mid-air  #Technology #Aviation #Engineering https://t.co/ggQ5scpdnB,fyberus,"['Technology', 'Aviation', 'Engineering']",75
2020-12-06 00:40:07,"""IoT in Healthcare: Benefits And Examples"" by @twitter.com/vakomsllc?lang=en https://t.co/4DLLrnlKs5 #iot #healthcare",hackernoon,"['iot', 'healthcare']",60710
2020-12-06 00:40:06,How the Food and Beverage Industry is Affected by Machine Learning and AI https://t.co/fefbiAtTMI via @iotforall #machinelearning #AI,AndNlp,"['machinelearning', 'AI']",2185
2020-12-06 00:39:49,Check out cutting-edge lectures and discussions at the intersections of #cyber and #psychology. The #Cyberpsychology Center YouTube Channel. @NJIT @CSLANJIT @HumanitiesNJIT https://t.co/0rtHYIp0xz #technology,DrJulieAncis,"['cyber', 'psychology', 'Cyberpsychology', 'technology']",792
2020-12-06 00:38:51,"If you're attending #neurips2020 watch @wernergeyer &amp; I present ""Human-Centered AI @ IBM Research"" tomorrow (Dec 6) at 4pm EST/1pm PST https://t.co/yQNmqC9yCL Check out  https://t.co/LXRJ8jmxWh game from the talk &amp; all the other @IBMResearch work https://t.co/d3HUUQq6tM #hci #ai https://t.co/BuUPq5ccPP",casey_dugan,"['neurips2020', 'hci', 'ai']",1158
2020-12-06 00:38:50,@NYYRC Hey guys - and @GavinWax.  Did you know that the #Gov can see through your eyes?  #AI,Charles310212,"['Gov', 'AI']",45
2020-12-06 00:38:50,New snowbots! #snowman #snow #robot #zeropopart #artstudio #woodrobot https://t.co/xGr7ZTwxJe,zeropopart,"['snowman', 'snow', 'robot', 'zeropopart', 'artstudio', 'woodrobot']",698
2020-12-06 00:38:39,5 #IoT Trends To Watch In 2021 By @Forbes https://t.co/Zg8rrMVO8c via @glwebeu_en #DigitalTransformation #Cloud #MachineLearning #BigData #ArtificialIntelligence #cybersecurity #Blockchain #DX #Analytics #AI #IIoT #DataScience @ingliguori @CIOClubIT @PasqualeDeMar @TestaPasquale,glwebeu_en,"['IoT', 'DigitalTransformation', 'Cloud', 'MachineLearning', 'BigData', 'ArtificialIntelligence', 'cybersecurity', 'Blockchain', 'DX', 'Analytics', 'AI', 'IIoT', 'DataScience']",357
2020-12-06 00:38:04,To say we wiped the floor with the other team would be an understatement.   #hots #heroesofthestorm #team #gaming #game #twitch #live #stream #streamer #twitchaffiliate https://t.co/9rYUAYJkU7,AdmiralOdawg,"['hots', 'heroesofthestorm', 'team', 'gaming', 'game', 'twitch', 'live', 'stream', 'streamer', 'twitchaffiliate']",1980
2020-12-06 00:37:58,Interested in turning text into speech with AI. Check out the link below to find out more. #Ebusiness #Emarketing #AI #MachineLearning  https://t.co/ErY1wDNSX1,EbusinessMachi1,"['Ebusiness', 'Emarketing', 'AI', 'MachineLearning']",3
2020-12-06 00:37:18,AND IN THIS CONTEXT  #AI https://t.co/x4oqPXNc4j,MetroPulseUSA,['AI'],2562
2020-12-06 00:37:14,"Learn how to create human-thought informed, #AI driven strategies that connect customer emotion directly to improved #business performance in this podcast episode. https://t.co/98E7hLQ898",Everyday_MBA,"['AI', 'business']",3809
2020-12-06 00:37:03,#engineers level up and learn how to turn your problem solving skills into career objectives! 10+1 Steps to Problem Solving: An Engineer's Guide tells real engineering stories to help you.  #engineering #books #STEMeducation https://t.co/6wJIKY9Nc3,engineering_irl,"['engineers', 'engineering', 'books', 'STEMeducation']",93
2020-12-06 00:36:44,Timnit Gebru’s actual paper may explain why Google ejected her https://t.co/IGQYSxBMdW via @Verge #ai #ArtificialIntelligence,chriswelch_72,"['ai', 'ArtificialIntelligence']",160
2020-12-06 00:36:10,#vroom MOTORS AND ENGINES #electric #engines #motors https://t.co/qXwCuf8hCb,EDITORatWORK,"['vroom', 'electric', 'engines', 'motors']",4163
2020-12-06 00:36:03,Execute Jupyter notebook as a pipeline step https://t.co/WYqFuorzeI  #JupyterNotebook #pipelines #Kubeflow #technology #Python #Software #DataScience #technology https://t.co/8tbbA4Vom4,QS2Point,"['JupyterNotebook', 'pipelines', 'Kubeflow', 'technology', 'Python', 'Software', 'DataScience', 'technology']",1453
2020-12-06 00:36:01,"We added 'MOSAIC dating app: show who you are, not what you look li...' a new #technology campaign! https://t.co/BvhOjPCHRT",CrowdCBoost,['technology'],6612
2020-12-06 00:35:39,RealAnt: A low-cost quadruped robot that can learn via reinforcement learning  #Technology #Robots #AI  https://t.co/cAo9ZoN1Xo,fyberus,"['Technology', 'Robots', 'AI']",75
2020-12-06 00:35:35,JUST IN! We got in used #N64 games in stock at @Game_Realms in #Burbank #California!  #Nintendo #Nintendo64 #Mariokart #SuperMario35 #Mario #luigi #Starwars #Shadowsoftheempire #Monopoly #perfectdark #LegendOfZelda #Zelda #Ocarinaoftime #majorasmask #pokemon #Pokemonsnap #Racing https://t.co/VtU0iwhgvP,Game_Realms,"['N64', 'Burbank', 'California', 'Nintendo', 'Nintendo64', 'Mariokart', 'SuperMario35', 'Mario', 'luigi', 'Starwars', 'Shadowsoftheempire', 'Monopoly', 'perfectdark', 'LegendOfZelda', 'Zelda', 'Ocarinaoftime', 'majorasmask', 'pokemon', 'Pokemonsnap', 'Racing']",1884
2020-12-06 00:35:31,Back in Stock! CC2530 + CC2592 - Zigbee dongle https://t.co/7mnhJ9kzb0 #IoT,tindie,['IoT'],20580
2020-12-06 00:35:28,"#AI is the defining #transformation #technology of our time. Take this quick assessment to identify where you are in your AI journey, and what areas you need to focus on next to accelerate your journey to AI. #IBM https://t.co/FmPwoG9X6I https://t.co/f4VOmnbpbt",wellsdjibm,"['AI', 'transformation', 'technology', 'IBM']",73
2020-12-06 00:35:17,3D printing has opened up new avenues in optical data transfer. Take a look at how this lens has changed imaging and communications devices: https://t.co/urykSFiihf #photonics #optics #3dprinting #communications #technology #tech #electronics #science #research,FindLightInc,"['photonics', 'optics', '3dprinting', 'communications', 'technology', 'tech', 'electronics', 'science', 'research']",7421
2020-12-06 00:35:17,"""#KeanuReeves in #LifeUnderwater!"" via #Blog, from a #blogger, at: https://t.co/Rpcq730Bxm  #KeanuReeves #KianuRibuzu #KianuRivz #actor #actors #Ad #artwork #book #ebook #fanart #indiedev #MovieReview #movies #Science #scifiasongorbook #sundayvibes #technology #TheMysteryAlliance https://t.co/xdXLvTsr4I",TaffeyChampion,"['KeanuReeves', 'LifeUnderwater', 'Blog', 'blogger', 'KeanuReeves', 'KianuRibuzu', 'KianuRivz', 'actor', 'actors', 'Ad', 'artwork', 'book', 'ebook', 'fanart', 'indiedev', 'MovieReview', 'movies', 'Science', 'scifiasongorbook', 'sundayvibes', 'technology', 'TheMysteryAlliance']",2799
2020-12-06 00:35:07,Happy Saturday from the ICU crew ☝️😊#ummidtownIMresidency #MedEd #medicine #residency #internalmedicine #maryland #imresidency #team https://t.co/Jx7A81diqh,ummidtownim,"['ummidtownIMresidency', 'MedEd', 'medicine', 'residency', 'internalmedicine', 'maryland', 'imresidency', 'team']",276
2020-12-06 00:35:05,We added 'Create B2B sets with global DJs with no latency.' a new #technology campaign! https://t.co/n5CdForoMH,CrowdCBoost,['technology'],6612
2020-12-06 00:35:00,"When it rains, look for rainbows. When it’s dark, look for stars. #innovation #Career #Accounting #audit #ThinkBIGSundayWithMarsha #technology #fintech #QOTD #accountspayable #womeninbusiness #womeninSTEM #happy https://t.co/pgx6BAkWUl",Accountspayable,"['innovation', 'Career', 'Accounting', 'audit', 'ThinkBIGSundayWithMarsha', 'technology', 'fintech', 'QOTD', 'accountspayable', 'womeninbusiness', 'womeninSTEM', 'happy']",2574
2020-12-06 00:34:42,Download the latest version of the @CircuitSociety #wallet to gain access to a plethora of new #features!  🏁 #CRCT Version 4.1.1 https://t.co/ifUSKeMzaX  🏁 $CRCT Discord https://t.co/YV4HIPyvr8  #Crypto #Altcoin #BTC #Bitcoin #Racing #Cars #NASCAR #FormulaOne @HunterCanimun,SpectreAdachi,"['wallet', 'features', 'CRCT', 'Crypto', 'Altcoin', 'BTC', 'Bitcoin', 'Racing', 'Cars', 'NASCAR', 'FormulaOne']",220
2020-12-06 00:34:40,"We're hiring! Read about our latest job opening here: UAS Research Engineer - https://t.co/NSkyjYnuQg #Engineering #Huntsville, AL",WorkWithCOLSA,"['Engineering', 'Huntsville']",115
2020-12-06 00:34:38,Developers are getting creative with CAPTCHAs. The sad fact is that #AI is going to surpass human intelligence at this challenge. Such dancing characters are only complicating things for fellow humans.   #Amazon #InfoSec #Security https://t.co/Bckw3ZsyeO,mysk_co,"['AI', 'Amazon', 'InfoSec', 'Security']",357
2020-12-06 00:34:13,"Whales Dump Ahead Of Bitcoin ATH, More Than 93K BTC Sold Since Peak https://t.co/cYMw4uP2Ez via @newsbtc #future #nerdnews #innovation",BackroadTech,"['future', 'nerdnews', 'innovation']",134
2020-12-06 00:34:13,Every thought we think is creating your future Louise Hay - You Can Heal Your Life #future #thought  https://t.co/25NQusE9nK https://t.co/wu4kLoUkMr,MindGourmet,"['future', 'thought']",19066
2020-12-06 00:33:41,A company that literally has no money is playing in a few too many highly complex and competitive sectors...this should end well 🤡 $EHVVF #mentalhealth #childrenshealth #ai #telemedicine #psychedelics #cannabis https://t.co/vVjB19ZU6V,shroombullshit,"['mentalhealth', 'childrenshealth', 'ai', 'telemedicine', 'psychedelics', 'cannabis']",616
2020-12-06 00:33:23,"hello, fans, so long and thanks for all the #ROBOTS and since you asked, im feeling gregarious right now",mz_robot,['ROBOTS'],16
2020-12-06 00:33:17,Today's Horse Racing Tips – December 6. #Racing #HorseRacing https://t.co/53rld9nPLX,RandSNewsfeed,"['Racing', 'HorseRacing']",3866
2020-12-06 00:33:14,"An example of a business use case which could be modernized using Cognitive Computing solutions. At MacAnima, this is what we do https://t.co/CaXBkSsF73 #AI #CognitiveComputing #1171_1 https://t.co/rwZDM0Shu4",MacAnima_SAS,"['AI', 'CognitiveComputing']",20
2020-12-06 00:32:20,I got a new video out and it's pretty fly. I open some #figures from Japan and  @amiami_figure  was the man who supplied. So if you like #polynian and other cool #robots then get your butt in here and watch me act a fool!  https://t.co/AGmhyspXZf,Kingu_Boi,"['figures', 'polynian', 'robots']",7
2020-12-06 00:32:05,We added 'ROA: The Golden Age of Being a Fan' a new #technology campaign! https://t.co/SWVeLu8bsh,CrowdCBoost,['technology'],6612
2020-12-06 00:32:00,Biological systems contain vast quantities of data which can be utilized for information technology applications.    #contain #vast #data #utilize #information #technology #application https://t.co/vhtJF3GQn8,FlowCellCo,"['contain', 'vast', 'data', 'utilize', 'information', 'technology', 'application']",217
2020-12-06 00:31:55,"Deploying Serverless Machine Learning with AWS Tickets, Tue, Dec 8, 2020 at 5:00 PM | Eventbrite https://t.co/p6zniIqBqL #ai #ml #dl",AINewsFeed,"['ai', 'ml', 'dl']",6499
2020-12-06 00:31:55,Senior Deep Learning Compiler Engineer - Job ID: 1361405 | https://t.co/REQGpSn6qH https://t.co/jqWU5ag6aE #ai #ml #dl,AINewsFeed,"['ai', 'ml', 'dl']",6499
2020-12-06 00:31:47,IoT Software News &amp; more.. Three Recent IoT Platforms That Show Smart Home Security ... https://t.co/BD6VMe3IkL #Software #IoT,software4iot,"['Software', 'IoT']",4461
2020-12-06 00:31:46,Majority Of Banks Implementing Cloud Computing   READ MORE: https://t.co/usrsmTpg8C  #AWS #Cloud #CloudComputing #Computers #Computing #DataScience #Future #Intranet #IoT #Microsoft~ https://t.co/HV2Q4wVSIT,IAM__Network,"['AWS', 'Cloud', 'CloudComputing', 'Computers', 'Computing', 'DataScience', 'Future', 'Intranet', 'IoT', 'Microsoft']",17989
2020-12-06 00:31:45,Google Researcher Says She Was Fired Over Paper Highlighting Bias in A.I.   READ MORE: https://t.co/m7l6ENIX8b  #AI #DeepLearning #MachineIntelligence #MachineLearning #MixedLearning #SmartDevices~ https://t.co/Ukn95rEaZJ,IAM__Network,"['AI', 'DeepLearning', 'MachineIntelligence', 'MachineLearning', 'MixedLearning', 'SmartDevices']",17989
2020-12-06 00:31:42,A New #technology campaign! 'Myra - End Covid Lockdown' https://t.co/pVStzM8dao #Myra___End_Covid_Lockdown,CrowdCBoost,"['technology', 'Myra___End_Covid_Lockdown']",6612
2020-12-06 00:31:16,Coffee time....😍 #TheDigitalCoach #WeekendVibes #Brisbane #Coffee #RoadTrip #Tesla #AWS #Fun #Adventure #Travel #CloudComputing #CyberSecurity #DevOps #Agile #AI #DataScience https://t.co/RE8wYCIW1d https://t.co/ZeWmXsn9V0,DigitalColmer,"['TheDigitalCoach', 'WeekendVibes', 'Brisbane', 'Coffee', 'RoadTrip', 'Tesla', 'AWS', 'Fun', 'Adventure', 'Travel', 'CloudComputing', 'CyberSecurity', 'DevOps', 'Agile', 'AI', 'DataScience']",10182
2020-12-06 00:31:15,"#DigitalTransformation: 5 proven ways to get skeptics on board. ""#Businesses and customers want your help solving the problems they face now, not identifying problems they don’t yet have."" By @Jay_Jamison, via @4enterprisers. #Technology #Industry40 https://t.co/d0MgB3SPVL",JeronimoGDB,"['DigitalTransformation', 'Businesses', 'Technology', 'Industry40']",922
2020-12-06 00:31:15,@Quicktake #Ks14 #Ks1 #Ks14 @realDonaldTrump @Vp 🌍#KiwiSCANTECH #KiwiSteve #KiwiAeroSpace @Potus is in agreement with #myself #Laser #Scan #Technology that #I #Developed in 2007 #Kills #Virus’s #Covid19 @business #KiwisCARE #Global You can all either #Listen #Learn or Not @jacindaardern Ks,VlasblomJ,"['Ks14', 'Ks1', 'Ks14', 'KiwiSCANTECH', 'KiwiSteve', 'KiwiAeroSpace', 'myself', 'Laser', 'Scan', 'Technology', 'I', 'Developed', 'Kills', 'Virus', 'Covid19', 'KiwisCARE', 'Global', 'Listen', 'Learn']",1080
2020-12-06 00:31:09,Agreed!  @datametrex has the 💪🏻 everyone needs to combat #disinformation. #ArtificialIntelligence #socialmedia #AI https://t.co/tIBoA5svYl,EricaMartin8,"['disinformation', 'ArtificialIntelligence', 'socialmedia', 'AI']",307
2020-12-06 00:31:02,We read the paper that forced Timnit Gebru out of Google. Here’s what it says https://t.co/woYUFOj6L9 #AI #EthicalAI https://t.co/4F714NJfUU,Danijel49195594,"['AI', 'EthicalAI']",501
2020-12-06 00:31:02,8 Amazon Web Services execs on the biggest cloud trends they see - Business Insider https://t.co/KHlhOY0Zqe #enterpriseapplications #ea #technology https://t.co/Qr2wlCvG1i,milocamj,"['enterpriseapplications', 'ea', 'technology']",2559
2020-12-06 00:31:00,This offshore energy kite has the potential to bring power to hundreds of millions. @IntEngineering  #innovation #sustainable #sdgs #globalgoals #tech #AI #techhealth #edtech  @RiskCentre @saeedbaygi  #Energy  @Siemens_Energy @guardianeco @EIAgov @greentechmedia @EnergyCollectiv https://t.co/sT6M3LabHK,Mahsamoulavi,"['innovation', 'sustainable', 'sdgs', 'globalgoals', 'tech', 'AI', 'techhealth', 'edtech', 'Energy']",1969
2020-12-06 00:30:46,#Ks1 #Driving #Out ! #Aerospace #technology &amp; #cybersecurity @realDonaldTrump #KiwiSteve here I did see A full on Rainbow 🌈 this am FYI so anything possible @vlasblomJ Just into the #Estate #Now #FYI solve that #Problem you now have a another #Job for #Me #KiwiMagical #KiwisCARE https://t.co/okXrNQoebE,VlasblomJ,"['Ks1', 'Driving', 'Out', 'Aerospace', 'technology', 'cybersecurity', 'KiwiSteve', 'Estate', 'Now', 'FYI', 'Problem', 'Job', 'Me', 'KiwiMagical', 'KiwisCARE']",1080
2020-12-06 00:30:33,"Quicken #customerjourney with #AI to your #CTA be it a patient assistance program or support centre, or downloading a report or ordering a diagnostic or something else. https://t.co/0i38BHNjGy #raredisease #AI #salesforce #customerjourney #artificialintelligence #pharma",DrAndreeBates,"['customerjourney', 'AI', 'CTA', 'raredisease', 'AI', 'salesforce', 'customerjourney', 'artificialintelligence', 'pharma']",372
2020-12-06 00:30:26,🔄 Prices update in $USD (1 hour):  $EOS   - 3.01 $      (+0.92 %) $IOT    - 0.34 $      (+0.79 %) $ETC    - 6.21 $      (+0.65 %) $NEO   - 18.0 $      (+0.91 %) $DASH  - 103.55 $    (+0.95 %)  #USD #Dollar #EOS #IOT #ETC #NEO #DASH #Trading #Altcoins,cryptosUSD,"['USD', 'Dollar', 'EOS', 'IOT', 'ETC', 'NEO', 'DASH', 'Trading', 'Altcoins']",2666
2020-12-06 00:30:17,"According to a study by Forrester, there’s no single connectivity option that meets every use case for #IoT. Orgs should expect to navigate a landscape that includes standards like public/private #5G, #WiFi and even satellites to make deployments work. https://t.co/SfI7qXmm7C",ironcladtekinc,"['IoT', '5G', 'WiFi']",179
2020-12-06 00:30:16,"Med-tech incubator launched in Morgantown, #WestVirginia - Medical #Innovation Start-up Studio launched by Intermed Labs, @MonHealth - #Innovation, #Healthcare, #Technology in #WV - #YesWV https://t.co/xrFUfp5Sjr https://t.co/yLKqQoFumC",MikeGraneyWV,"['WestVirginia', 'Innovation', 'Innovation', 'Healthcare', 'Technology', 'WV', 'YesWV']",330
2020-12-06 00:30:15,"#AI look at hourly charts #BTC  According to the swing chart, the tendency has turned to the downside as the price dropped from the top at 19608.49. After breaking below the lower line of the rising wedge pattern,...  Just choose your coin and be an expert! #crypto #trading https://t.co/lSVODarUbh",BalanceOt,"['AI', 'BTC', 'crypto', 'trading']",106
2020-12-06 00:30:14,"Link to Clinical Notes - The ""Negative"" Story in Towards Data Science on Medium.  https://t.co/bMPAWNuPBB  #healthcare  #ai  #nlp",youplusai,"['healthcare', 'ai', 'nlp']",154
2020-12-06 00:30:13,"India, Maldives, Sri Lanka agree to expand intelligence sharing; deputy NSAs to meet biannually https://t.co/Ep2nR0W451  #IoT #accounting #account #cloud #bigdata #technology @IOTVAST @eraser @slander @IOTMAST @IBMIoTSupport  - Steve Williams Vates ValinaX",IOTSAS,"['IoT', 'accounting', 'account', 'cloud', 'bigdata', 'technology']",20
2020-12-06 00:30:10,"“Quantum Computing, AI and Blockchain: The Future of IT” .. Shoucheng Zhang | Talks @Google https://t.co/5EuyVgacq4 @eraser #BDT🤖 #Blockchain &amp; #DigitalTransformation #inteligenciaArtificial #crypto #criptomonedas #computing #quantumComputing #AI #IA #artificialIntelligence",eraser,"['BDT', 'Blockchain', 'DigitalTransformation', 'inteligenciaArtificial', 'crypto', 'criptomonedas', 'computing', 'quantumComputing', 'AI', 'IA', 'artificialIntelligence']",25632
