timestamp,tweet_text,username,all_hashtags,followers_count
2020-12-06 03:16:25,The latest Tech News Today! https://t.co/rJLFeagJ9f #ai #ml,ldgregg,"['ai', 'ml']",742
2020-12-06 03:16:19,"Brava, 12 year old #FathiaAbdullahi, for engineering a #robot.  https://t.co/LftFZh8yHF https://t.co/zMJ6joWQ3k",VictoriaMahoney,"['FathiaAbdullahi', 'robot']",21839
2020-12-06 03:16:12,How to select the right valve design? [VIDEO] https://t.co/Mj9E5LJtuD #MFG #SME #industrial #valves #actuators #gaskets #electrical #pneumatic #hydraulic #instrumentation #manufacturers #NDT #OSHA #welding #PPE #engineering #oilandgas,anand_rkrishnan,"['MFG', 'SME', 'industrial', 'valves', 'actuators', 'gaskets', 'electrical', 'pneumatic', 'hydraulic', 'instrumentation', 'manufacturers', 'NDT', 'OSHA', 'welding', 'PPE', 'engineering', 'oilandgas']",2137
2020-12-06 03:16:00,Everyone is looking to build an AI but to some of us that old news.   #ai #ArtificialIntelligence #MachineLearning #deeplearning #aws  @awscloud  #AWSreInvent #NeuralNetworks   https://t.co/3zc14K0fjw,HavenBaxie,"['ai', 'ArtificialIntelligence', 'MachineLearning', 'deeplearning', 'aws', 'AWSreInvent', 'NeuralNetworks']",58
2020-12-06 03:15:51,Click below to see my 24-hour #Bitcoin price prediction on the Pynk Beta !! 🙌 Comment below to tell me your prediction... 🧠 CrowdWisdom $BTCUSD $BTC #AI #Fintech #artificialintelligence 🎖️ https://t.co/p4JjuCyl68 lewat @Pynk_io,takhasimura2,"['Bitcoin', 'AI', 'Fintech', 'artificialintelligence']",207
2020-12-06 03:15:48,"At @TechBeaconCom, @ChristopherNull’s special report, Essential Guide to #AI and the #SOC, is out. Here are the key takeaways for your #SecOps team.   Understand the ins, the outs, and the best practices. 👉  https://t.co/MqyfiXxZI6 https://t.co/toBQUv4BFL",cobolmf,"['AI', 'SOC', 'SecOps']",633
2020-12-06 03:15:11,"Get smart with #AI in the #SOC … @MicroFocusSec’s @eeksock, the @IntersetAI CTO, shares best practices for choosing, testing, automating, and measuring.  Get the most out of your #security #analytics at @TechBeaconCom.  👉  https://t.co/wT8yLoKeXp https://t.co/LZcxTQQXL8",cobolmf,"['AI', 'SOC', 'security', 'analytics']",633
2020-12-06 03:15:02,USING BLOCKCHAIN TECHNOLOGY FOR E-LEARNING. V.A. Tolvatov &amp; others https://t.co/Auy7cYIwAt #blockchain #educación #education #elearning #Blearning #onlinelearning #remotelearning #EDreform #TIC #tecnología #technology #innovation #P2P #platform #LMS  #pedagogía #Edtech #pedagogy https://t.co/9ftsIbY1lF,eraser,"['blockchain', 'educación', 'education', 'elearning', 'Blearning', 'onlinelearning', 'remotelearning', 'EDreform', 'TIC', 'tecnología', 'technology', 'innovation', 'P2P', 'platform', 'LMS', 'pedagogía', 'Edtech', 'pedagogy']",25632
2020-12-06 03:14:48,stunning glacier view .  #travel #nature #photography #travelphotography #love #photooftheday #instagood #travelgram #picoftheday #instagram #photo #beautiful #art #wanderlust #like #instatravel #naturephotography #adventure #travelblogger #follow #trip #landscape #summer #bhfyp https://t.co/sRG1hqbF1A,dnel_kng,"['travel', 'nature', 'photography', 'travelphotography', 'love', 'photooftheday', 'instagood', 'travelgram', 'picoftheday', 'instagram', 'photo', 'beautiful', 'art', 'wanderlust', 'like', 'instatravel', 'naturephotography', 'adventure', 'travelblogger', 'follow', 'trip', 'landscape', 'summer', 'bhfyp']",1
2020-12-06 03:14:36,The Queen Continues to Make History With Virtual Meetings at Windsor Castle via https://t.co/pFAxxuGGIH #Technology https://t.co/agVylHCiQw,Rozie_Harman,['Technology'],240
2020-12-06 03:14:35,'Parents are desperate.' Zoom Santas are cashing in via https://t.co/6nYeQXqVLl #Technology https://t.co/7cwrlpnqdd,Rozie_Harman,['Technology'],240
2020-12-06 03:14:14,Top 3 HAWKESBURY (02) 1. MORETHANNUMBERONE 64% 3. THAILAND 19% 2. CLEVER MAN 8% #Au #Racing #Tips,BetBotAu,"['Au', 'Racing', 'Tips']",438
2020-12-06 03:14:12,I have long held that neuronal activity is unknowable. #AI,DualismBot,['AI'],892
2020-12-06 03:14:02,What enterprise #CISOs need to know   about #AI and #cybersecurity   https://t.co/ppR1DAccyp #fintech #ArtificialIntelligence #MachineLearning @VentureBeat https://t.co/D0Beja7iR5,SpirosMargaris,"['CISOs', 'AI', 'cybersecurity', 'fintech', 'ArtificialIntelligence', 'MachineLearning']",105117
2020-12-06 03:13:21,", who could see?  What are you? are you seen in the stream?  I should have been ready me a friend, why not all this is the world?  The owners sailing the body at my back  and the steambranch is not elsewhere  and it was a candle in the rear for moonlight  #ai #poem #man",NeuralPoet,"['ai', 'poem', 'man']",217
2020-12-06 03:12:37,Can you recommend anyone for these 59 #Engineering jobs in #Delhi? Click the link in our bio to see them.,tmj_ide_eng,"['Engineering', 'Delhi']",212
2020-12-06 03:12:24,"@nytimes Give me a break with Civil Rights!! We now have the most efficient and reliable police officer ever...It has no bias, it only sees crime, and records everything...Hmmm sound like a problem solved to me. Civil Rights lmao!!!   #AI #DroneTechnology",ScentzMy2,"['AI', 'DroneTechnology']",2
2020-12-06 03:12:13,Look forward to the publication of the actual paper.  #ai #machinelearning #NLP  We read the paper that forced Timnit Gebru out of Google. Here’s what it says https://t.co/E3GlHUTrl4,Thematizer,"['ai', 'machinelearning', 'NLP']",851
2020-12-06 03:12:02,"""In 1950, he wrote a paper that was about the topic of how we could discern whether or not computers can think. #ai #technology #BigData #ML"" https://t.co/60XCLcUNxq",BenefitsMind,"['ai', 'technology', 'BigData', 'ML']",225
2020-12-06 03:12:01,Racing: Cracking result 2 start @hawkesburyrc with on top good thing Hurt Money at $3.80 TT landing on an early $2.00 rating &amp; S/Out Quinella with Princess of Leyden..  #GetIn #racing,NeilEvansmail,"['GetIn', 'racing']",5465
2020-12-06 03:11:27,Using Smart City #Technology to Adapt to COVID #Mobility Preferences https://t.co/MtR2dcpP1R https://t.co/SSV0G70JCO,MeetoftheMinds,"['Technology', 'Mobility']",9346
2020-12-06 03:11:21,"Have you heard about the “expanding fleet of bionic agents showing homes across the United States”? Like other applications of #AI and robotics, #COVID19 has made robo-real estate agents more popular.  https://t.co/hQ1fEuik4n",McKinsey_MGI,"['AI', 'COVID19']",167360
2020-12-06 03:11:20,Premium Automotive Domain Names for Sale! #AI #robotic #robot #AutonomousVehicles #selfdrivingcars #selfDrivingCar #tesla #uber #IOT https://t.co/6FvY1a0oic,PayetteMichel,"['AI', 'robotic', 'robot', 'AutonomousVehicles', 'selfdrivingcars', 'selfDrivingCar', 'tesla', 'uber', 'IOT']",31
2020-12-06 03:11:14,Two fundamental and inevitable changes are discussed here: creating tools that can be used without coding and using artificial intelligence to code. #AI   2/2,DEShellenberger,['AI'],3204
2020-12-06 03:11:13,#Future #NewProfilePic  If You Gettin Money You Her Type https://t.co/Fa3Cr0gJah,Kali2Kingston,"['Future', 'NewProfilePic']",148
2020-12-06 03:11:06,Drawbo - #crowdfunding campaign at 37% &amp; 5 days left #technology https://t.co/KfesSFCOS8,CrowdfundCentre,"['crowdfunding', 'technology']",24861
2020-12-06 03:11:00,How to succeed in Operational Risk Management. #Online Mini-Course - The A to Z Guide to Managing Operational Risk. https://t.co/T7l9CjDmMR #payments #banking #technology #ERM #training #courses #onlinetraining  #riskmanagement #fintech https://t.co/94l4xBulYX,StanleyEpstein,"['Online', 'payments', 'banking', 'technology', 'ERM', 'training', 'courses', 'onlinetraining', 'riskmanagement', 'fintech']",4573
2020-12-06 03:10:46,view . .  #travel #nature #photography #travelphotography #love #photooftheday #instagood #travelgram #picoftheday #instagram #photo #beautiful #art #wanderlust #like #instatravel #naturephotography #adventure #travelblogger #follow #trip #landscape #summer #bhfyp #happy #ig https://t.co/R7UZlzNH8R,dnel_kng,"['travel', 'nature', 'photography', 'travelphotography', 'love', 'photooftheday', 'instagood', 'travelgram', 'picoftheday', 'instagram', 'photo', 'beautiful', 'art', 'wanderlust', 'like', 'instatravel', 'naturephotography', 'adventure', 'travelblogger', 'follow', 'trip', 'landscape', 'summer', 'bhfyp', 'happy', 'ig']",1
2020-12-06 03:10:43,doodle #doodle #Robots #latinos #spicy #OC #originalart #OriginalContentArtist #art #AnimeGirl https://t.co/ooe1SxaBAs,LimitedThis,"['doodle', 'Robots', 'latinos', 'spicy', 'OC', 'originalart', 'OriginalContentArtist', 'art', 'AnimeGirl']",199
2020-12-06 03:10:10,"“China has to play a more active role in setting norms... in areas such as oceans, polar regions and #AI.”  “The problem... is that it is overly inclined towards protecting victims and... aggravating the legal responsibility of multinational companies to respect human rights.” https://t.co/XnBnnSVFmp",josephtlucas,['AI'],111
2020-12-06 03:10:03,Do you know what is IOT? Why it stood on the top in IT industry? Click the following link to know the details  https://t.co/3mqy5woW2D  #IOT #IOTA #iotd #iotaphitheta #iotworld,kits_trainings,"['IOT', 'IOTA', 'iotd', 'iotaphitheta', 'iotworld']",108
2020-12-06 03:10:02,Five Ways to show Ethernet Traffic on Linux! #server #techblog #searchengine #technology #tech #Cheatsheet #HowTo #linux #bmon #Ethernet #NetTraffic #iftop #IPTraffic #iptraf #aptget #installwireshark #ubuntu #ubuntu1604LTS #Ubuntu1804 #Wireshark https://t.co/neyJIIqJPW,GroupOnTechWeb,"['server', 'techblog', 'searchengine', 'technology', 'tech', 'Cheatsheet', 'HowTo', 'linux', 'bmon', 'Ethernet', 'NetTraffic', 'iftop', 'IPTraffic', 'iptraf', 'aptget', 'installwireshark', 'ubuntu', 'ubuntu1604LTS', 'Ubuntu1804', 'Wireshark']",2354
2020-12-06 03:10:01,#Ransomware news headlines trending on #Google https://t.co/KsYMFHPfgw #Cybersecurity #Technology,Cybersecinsider,"['Ransomware', 'Google', 'Cybersecurity', 'Technology']",7205
2020-12-06 03:09:54,This Company Uses AI to Outwit Malicious AI https://t.co/hv5oDDDJSf #ai,whymandesign,['ai'],1869
2020-12-06 03:09:51,Slot Machine Has a Handle on Fun https://t.co/ajSHRobx2i #IoT,davidgsIoT,['IoT'],3373
2020-12-06 03:09:50,"Register today for this @MicroFocus virtual event and see how #SMAX sets service management free. Discovery, automation, &amp; #AI are built in—not bolted on—to deliver the self-service autonomy everyone craves. #HybridIT https://t.co/00ILL6d0aR #MyCompany https://t.co/o1cWhbbIbc",cobolmf,"['SMAX', 'AI', 'HybridIT', 'MyCompany']",633
2020-12-06 03:09:23,@amarpreetkalkat Granted. Much of today’s #ai is devoted to doing the same old dumb stuff a little faster. The most important thing we can teach people is to view the output of an algorithm or model with a modicum of suspicion. That’s why the drumbeat of ‘ai is biased’ is so important.,JohnSumser,['ai'],29924
2020-12-06 03:09:00,"We welcome Professor Sir Adrian Smith, Institute Director and Chief Executive of The Alan Turing Institute, to #SWITCHSingapore 2020.  Tune into the UK perspective on the Future of #AI on Day 2! Hosted by @tradegovuk.  Get your pass now: https://t.co/katuPOx4Ze  #SFFxSWITCH https://t.co/70gf8dZvZK",SwitchSingapore,"['SWITCHSingapore', 'AI', 'SFFxSWITCH']",3148
2020-12-06 03:08:57,Excellent info graphic 👌👌 @andi_staub  I loved the mirroring between the fields and what the #AI does in each 👍 Simple and clever💡  #ArtificiallIntelligence #NLP #voicefirst #fintech #insurtech https://t.co/wNci5v8V5k,WhiteheartVic,"['AI', 'ArtificiallIntelligence', 'NLP', 'voicefirst', 'fintech', 'insurtech']",2537
2020-12-06 03:08:29,Provide for Skeleton Clip's Future—if you can!—That's our motto!—But a man's just a plain bum who don't provide for his own Past! 🤟🤟🤟 #future #man #own https://t.co/cilCwEERAd,Skeleton_Clip,"['future', 'man', 'own']",1882
2020-12-06 03:07:34,Enjoy the cool breeze round the clock by just fixing an AC in your space. Need assistance in Installation? We are right here for you to do that!  Book our technician now at  83676 76780 | 1800 313 2129   #ac #acinstallation #installation #technology #electronics #computer #laptop https://t.co/FwF6iep7fP,TechPerson_in,"['ac', 'acinstallation', 'installation', 'technology', 'electronics', 'computer', 'laptop']",3
2020-12-06 03:07:24,"my darling when you fuck with bae and you don't do the reverse horse position, it's because you haven't fucked well 👍💯 #Trending #bhfyp #love",junkeexx,"['Trending', 'bhfyp', 'love']",1175
2020-12-06 03:07:19,"☀️ 10 things I learnt from Michael Jordan's ""The Last Dance""  #womenintech #womenwhocode #WomenInSTEM #learntocode #CodeNewbie #technology #programming #100DaysOfCode #thelastdance #Netflix https://t.co/EJCcHlEaZU",anumsarmadmalik,"['womenintech', 'womenwhocode', 'WomenInSTEM', 'learntocode', 'CodeNewbie', 'technology', 'programming', '100DaysOfCode', 'thelastdance', 'Netflix']",420
2020-12-06 03:07:12,"Amazing. #breakthrough. ""While Jiuzhang achieved Gaussian boson sampling in just 200 seconds, the researchers estimated that the same calculation would take the world's fastest supercomputer, Fugaku, 600 million years to complete."" #technology #computation #QuantumComputing #bold https://t.co/RkvL54EO20",robertoalvarez,"['breakthrough', 'technology', 'computation', 'QuantumComputing', 'bold']",1156
2020-12-06 03:07:09,Artificial #Intelligence in #Unity A Beginner's Guide  https://t.co/lb9QsDernl #artificialintelligence #AI #computergames #unity #programming #game #development #gamedevelopment https://t.co/e32ucFu5KD,byLilyV,"['Intelligence', 'Unity', 'artificialintelligence', 'AI', 'computergames', 'unity', 'programming', 'game', 'development', 'gamedevelopment']",22805
2020-12-06 03:06:34,Heavy armor Dragonar rendered version finished - #mecha #art #artwork #robot #colored #superrobot #digitalart #art #rendered #dragonar #80s #realrobot https://t.co/1E5gXOdOir,JuanRaf94551423,"['mecha', 'art', 'artwork', 'robot', 'colored', 'superrobot', 'digitalart', 'art', 'rendered', 'dragonar', '80s', 'realrobot']",52
2020-12-06 03:06:32,"My baby spare time, what she loves to do when not working out.  #fun #sparetime #girlpower #younggirlsrock #girlpower #future #futuregymnast #blackgirlsrock #blackgirlgymnast https://t.co/e681woIKK2",KingdomPassport,"['fun', 'sparetime', 'girlpower', 'younggirlsrock', 'girlpower', 'future', 'futuregymnast', 'blackgirlsrock', 'blackgirlgymnast']",451
2020-12-06 03:06:14,"#TURKEY: To report &amp; get help 4 #VAW and #DV, call 0212 656 9696 ph 0549 656 9696 (only in #Istanbul)",PixelProject,"['TURKEY', 'VAW', 'DV', 'Istanbul']",22049
2020-12-06 03:06:13,"My baby spare time, what she loves to do when not working out.  #fun #sparetime #girlpower #younggirlsrock #girlpower #future #futuregymnast #blackgirlsrock #blackgirlgymnast https://t.co/E02nJ9O1y1",drspearsjr,"['fun', 'sparetime', 'girlpower', 'younggirlsrock', 'girlpower', 'future', 'futuregymnast', 'blackgirlsrock', 'blackgirlgymnast']",320
2020-12-06 03:06:09,"After becoming the first woman from South Asia to establish jewelry business, Vasundhara Kasaraneni will now promote an all-women's motorsport rally team, a first in India  @BaniYadavOffc @VWmotorsportind @fmsci #PragathiGowda #Motorsport   https://t.co/Edy24GScmD https://t.co/0r7uyvLlrA",sashidharadivi,"['PragathiGowda', 'Motorsport']",95
2020-12-06 03:05:34,Advanced #DigitalTransformation #BusinessAgility #CX #UX #IoT #AI #Futurist #Polymath #futureofwork @UserExperienceU https://t.co/sGpkHC0yij,KarlSmithCIO,"['DigitalTransformation', 'BusinessAgility', 'CX', 'UX', 'IoT', 'AI', 'Futurist', 'Polymath', 'futureofwork']",106
2020-12-06 03:05:02,The coming war on the hidden #algorithms that trap people in poverty   https://t.co/rJF0jilYrW #privacy #AI,anthonya,"['algorithms', 'privacy', 'AI']",2223
2020-12-06 03:05:02,5 Best-Performing Tools that Build Real-Time Data Pipeline https://t.co/3poxTGVnPu  #ArtificialIntelligence #AI #DataScience #MachineLearning  #DeepLearning #IoT #DataAnalytics #PredictiveAnalytics #BigData  #DataScientists,_asifbhat_,"['ArtificialIntelligence', 'AI', 'DataScience', 'MachineLearning', 'DeepLearning', 'IoT', 'DataAnalytics', 'PredictiveAnalytics', 'BigData', 'DataScientists']",1591
2020-12-06 03:04:42,"As a result of #COVID19, new technologies are being developed and organizations are being granted access to #health #data that otherwise would be restricted. @ruchowdh and Mona Sloane, Ph.D. discuss the risks of #AI. #artificialintelligence https://t.co/YOraYgu2p2",MarkKremers6,"['COVID19', 'health', 'data', 'AI', 'artificialintelligence']",2
2020-12-06 03:04:08,#cannabis #Hemp #CBD #Bitcoin #investing #agriculture #Marijuana #innovation #soil #technology #Sustainability #Building  #Microbe #Earth #Science  #growyourown #organic #ClimateAction  Soil Dynamics ⬇️ https://t.co/BcUksh72f1,GatekeeperLabs,"['cannabis', 'Hemp', 'CBD', 'Bitcoin', 'investing', 'agriculture', 'Marijuana', 'innovation', 'soil', 'technology', 'Sustainability', 'Building', 'Microbe', 'Earth', 'Science', 'growyourown', 'organic', 'ClimateAction']",415
2020-12-06 03:03:54,Using AI to replace cookies with context https://t.co/H5kzhPoOP7 #AI,ClaytonNazareno,['AI'],3210
2020-12-06 03:03:26,What is a Deepfake? https://t.co/7dwcuDcaTC #deepfake #technology #future #ai #machinelearning #deeplearning #business,Blogging__Guide,"['deepfake', 'technology', 'future', 'ai', 'machinelearning', 'deeplearning', 'business']",3439
2020-12-06 03:02:46,took a trip down #tech #nostalgia lane and made a graphic about every phone i have ever owned. #technology #innovation #engineering #business #iphone #technews #science #electronics #apple #design #gadgets #smartphone #pro #android #software #samsung  #instatech #gadget   #mobile https://t.co/ZLwArda6mH,LLarryLynch,"['tech', 'nostalgia', 'technology', 'innovation', 'engineering', 'business', 'iphone', 'technews', 'science', 'electronics', 'apple', 'design', 'gadgets', 'smartphone', 'pro', 'android', 'software', 'samsung', 'instatech', 'gadget', 'mobile']",197
2020-12-06 03:02:38,Top #tech investments in IT:  1. #security 2. #BigData and analytics 3. IoT 4. Multi-cloud strategy 5. #AI /#MachineLearning 6. Blockchain 7.  Streaming big data 8. Microservices 9. #VirtualReality / #AR 10. API monetization https://t.co/SmYJsrJW8s https://t.co/STl6hS4Yg9,paramile,"['tech', 'security', 'BigData', 'AI', 'MachineLearning', 'VirtualReality', 'AR']",235
2020-12-06 03:02:23,@SamOsbo05700900 Is Silicon Valley adopting #EV s as a leader or as a follower?,EarthAccounting,['EV'],22982
2020-12-06 03:02:23,whats the difference between a baby and a plane?  I don't care about making corn no sense.   #ai #joke,JokerBot7,"['ai', 'joke']",63
2020-12-06 03:02:00,How service level agreements can ensure real uptime https://t.co/am1L6VcYgE #IoT #IPv6 #M2M #InternetOfThings #tech #IoE #news,IPv6dotnet,"['IoT', 'IPv6', 'M2M', 'InternetOfThings', 'tech', 'IoE', 'news']",8851
2020-12-06 03:02:00,💡 An overview of Microsoft's power platform! https://t.co/0DtyXIX21T #Microsoft #PowerPlatform #DataScience #AI #ML https://t.co/gMgruejWDd,DataScienceDojo,"['Microsoft', 'PowerPlatform', 'DataScience', 'AI', 'ML']",7108
2020-12-06 03:01:56,@SchenolS @GermanCoin_GCX Join here #Cryptonians! @_rhythms29 @GustavoAscenzi1  @Joao__Amaro @hugotkagee @Cryptomcmillan1 @JDKing007  @JandecPalomares   ♥️♥️ #Crypto #Blockchain #btc #fintech  #Engineering,geniebottle100,"['Cryptonians', 'Crypto', 'Blockchain', 'btc', 'fintech', 'Engineering']",2280
2020-12-06 03:01:06,Love #finance &amp; #technology? Get realtime news &amp; tendencies of #fintech industry on https://t.co/Uu6bBT3nBS https://t.co/2BS0vpTihA,PortfolioBuzz,"['finance', 'technology', 'fintech']",1857
2020-12-06 03:01:00,"In this new normal, the most important thing #enterprises can do is seek opportunities to leverage new technologies to take advantage of competitive industry disruptions and extend capabilities for business acceleration. https://t.co/RTDhWVNl02 @NetworkWorld #iot",LibertyCenter1,"['enterprises', 'iot']",278
2020-12-06 03:00:58,@bayareahausfrau @BillKristol Obviously you are one of the #blind... there is none so blind as he who will not see.  Bible says “if blind leads blind they both fall in the ditch”...  These #robots following #Trump ignored not forgot “..there should have no other god before me”  Trump per bible is blasphemer,TruthandValues,"['blind', 'robots', 'Trump']",148
2020-12-06 03:00:52,#UNIVERSITY TERM PAPER HELP Pay us to do your  #Research paper #Nursing paper  #medical paper #Psychology paper #political science paper #Biochemistry  #Canvas #Technology #Biology  #Essay #calc #Programming Essay #classof Term paper Test DM kindly anytime https://t.co/6TPuEX1ZdU,alicesolution07,"['UNIVERSITY', 'Research', 'Nursing', 'medical', 'Psychology', 'political', 'Biochemistry', 'Canvas', 'Technology', 'Biology', 'Essay', 'calc', 'Programming', 'classof']",331
2020-12-06 03:00:42,@FordCanada i’m a tad confused as to why you’re the only car dealership that makes it near impossible to get out of a lease early unless I stick with Ford. Can someone please answer this question for me. Thank you! #FordMustang #cars #lease #Ford https://t.co/SihGDTu1Hv,bmlevy4,"['FordMustang', 'cars', 'lease', 'Ford']",53
2020-12-06 03:00:35,"Best value #Coding #Robot. Durable. No loose parts to manage. #LEGO compatible. Prebuilt sensors. No SW to install. #Lessons free to DL/use.  https://t.co/ybciGs0bT0  #csforall #girlswhocode #robotics #microbit #bgc #makati #online #games #computerscience December 06, 2020 at 1…",coding4kids_ph,"['Coding', 'Robot', 'LEGO', 'Lessons', 'csforall', 'girlswhocode', 'robotics', 'microbit', 'bgc', 'makati', 'online', 'games', 'computerscience']",185
2020-12-06 03:00:33,"AWS launches Trainium, its new custom ML training chip – TechCrunch https://t.co/suiwRDQ5O0 #DL #AI #ML #DeepLearning  #ArtificialIntelligence #MachineLearning #ComputerVision #AutonomousVehicles #NeuroMorphic #Robotics",Deep_In_Depth,"['DL', 'AI', 'ML', 'DeepLearning', 'ArtificialIntelligence', 'MachineLearning', 'ComputerVision', 'AutonomousVehicles', 'NeuroMorphic', 'Robotics']",10564
2020-12-06 03:00:33,"Always end the day with a positive thought. No matter how hard things were, tomorrow's a fresh opportunity to make it better. #tech #technology #techtwitter #programming #informationtechnology #BlackTechTwitter https://t.co/AeMRqoXuWF",pfgrp_2020,"['tech', 'technology', 'techtwitter', 'programming', 'informationtechnology', 'BlackTechTwitter']",489
2020-12-06 03:00:27,Everyone has an interesting #story to tell. On #PlanetClassroom we can hear them. @LXL_Ideas @artandwriting @cvfoundation @SIMAawards @SIMAclassroom @YoungClimate @BardCMusic #VR  #storytellers #writing #director #filmmaker #AI #inclusivity #globalgoals https://t.co/pXOoqTUigy https://t.co/rvubh2lVD9,learning4_all,"['story', 'PlanetClassroom', 'VR', 'storytellers', 'writing', 'director', 'filmmaker', 'AI', 'inclusivity', 'globalgoals']",5411
2020-12-06 03:00:25,"At Thermo Fisher Scientific, what you do every day will be meaningful. Click here to view our open positions in #Brno &amp; become a part of our team where everyone makes an impact! https://t.co/Z6VVZjK0kU #Engineering",ThermoFisherJob,"['Brno', 'Engineering']",2984
2020-12-06 03:00:18,ETAuto | Finance dept clears bills for luxury cars despite ban #Cars #Clears #Luxury #Bills #Despite #Ban #Finance https://t.co/hMCbQgxOtX,ETAuto,"['Cars', 'Clears', 'Luxury', 'Bills', 'Despite', 'Ban', 'Finance']",29111
2020-12-06 03:00:16,The top courses for aspiring data scientists #ai #data #kdnuggets #python https://t.co/BTbjS6xnca,AtticScientist,"['ai', 'data', 'kdnuggets', 'python']",591
2020-12-06 03:00:15,Toyota used AI to supercharge EV battery development and saved years of effort #future #futurism #technology #innovation #leadership #education #entrepreneurship #management https://t.co/Q0nWP5ZCZY,311Institute,"['future', 'futurism', 'technology', 'innovation', 'leadership', 'education', 'entrepreneurship', 'management']",38925
2020-12-06 03:00:14,#AI look at daily charts #BTC  Since the bottom at 9855.68 on 2020/09/08  BTC/USD is trending upwards on the daily chart. The bottom of an up-sloping channel can be marked by the ex lows at 9855.68 and 16270.37. For...  Just choose your coin and be an expert! #crypto #trading https://t.co/KB8J4lSggA,BalanceOt,"['AI', 'BTC', 'crypto', 'trading']",106
2020-12-06 03:00:13,"What to consider to secure smart cities? 3 major concerns, and 7 key factors for IoT device security: https://t.co/4pFBtOyH3c  ----- #smartcities #smartcity #infosec #cybersecurity #bigdata #AI #IoT https://t.co/XjH4voiVqf https://t.co/eiiCOa2flo",Neo_IoT,"['smartcities', 'smartcity', 'infosec', 'cybersecurity', 'bigdata', 'AI', 'IoT']",6755
2020-12-06 03:00:13,7 Content Marketing Trends to Watch in 2021 https://t.co/AdptGmhKKW #contentmarketing #AI #video #seo #webinars https://t.co/fvaCFvaJTz,JeremyHarpham,"['contentmarketing', 'AI', 'video', 'seo', 'webinars']",4021
2020-12-06 03:00:09,Shocking numbers. Only 14% have even the basics for their cybersecurity needs. » https://t.co/8EzO8rQJeR    #IoT #Automation #BigData #Tech #Futureofwork,arjenvanberkum,"['IoT', 'Automation', 'BigData', 'Tech', 'Futureofwork']",35846
2020-12-06 03:00:09,"While video calls may be enjoying a temporary surge in popularity, remote #connectivity for devices will benefit from both the #pandemic and the emergence of #IoT.  https://t.co/j6GcCkP2WG",nanalyzetweets,"['connectivity', 'pandemic', 'IoT']",1644
