timestamp,tweet_text,username,all_hashtags,followers_count2020-12-06 01:33:38,Every nucleus in the human body has DNA of 6 feet long. #technology #marine #zoology #plants #mathematical #cell https://t.co/mktjxufUAH,SanmedSciences,"['technology', 'marine', 'zoology', 'plants', 'mathematical', 'cell']",46
2020-12-06 01:33:13,"#UX #IoT and #Blockchain with #KarlSmith of Paradigm Interactions Inc #UX, #IoT, and #Blockchain with #CEO Karl Smith of Paradigm Interactions Inc. #podcast #AI #IoT #UX #CX #BusinessAgility #BusinessTransformation @UserExperienceU @KarlSmithCIO https://t.co/UyFF8ZL4ea https://t.co/hYrh9mfEST",InteractionsInc,"['UX', 'IoT', 'Blockchain', 'KarlSmith', 'UX', 'IoT', 'Blockchain', 'CEO', 'podcast', 'AI', 'IoT', 'UX', 'CX', 'BusinessAgility', 'BusinessTransformation']",8722
2020-12-06 01:33:03,The 5 Biggest #CloudComputing Trends In 2021  https://t.co/80IrauCB8C by @BernardMarr v/ @Forbes #AI #BigData Cc @jblefevre60 @Ym78200 @kalydeoo @roxanasoi @TriciaKicksSaaS @Shirastweet @ShellyKramer @adamsconsulting https://t.co/txRinTES2Q,ipfconline1,"['CloudComputing', 'AI', 'BigData']",112756
2020-12-06 01:33:02,At 15 yr old young lady ahead of her time is already using #Computing and #AI to solve real world problems. https://t.co/q77Q2OQcCE,WWalkerWW,"['Computing', 'AI']",1855
2020-12-06 01:32:19,Hackers Black Shadow leaks sensitive client information as Israeli insurer Shirbit refuses to pay $1 million ransom https://t.co/2hTFzbU3fZ #cybersecurity #databreach #tech #encryption #hacked #leaked #privacy #security #technology #hacker #leaks #news #shirbit #blackshadow https://t.co/ykECR4slAZ,LinkdoodAsia,"['cybersecurity', 'databreach', 'tech', 'encryption', 'hacked', 'leaked', 'privacy', 'security', 'technology', 'hacker', 'leaks', 'news', 'shirbit', 'blackshadow']",27
2020-12-06 01:32:01,"As global economic growth slows, world policymakers hope artificial intelligence will provide a magic solution for increased productivity. In this @WorldBoston talk, two Brookings Institute scholars discuss the risks and opportunities of an #AI future. ▶️ https://t.co/R2L4zqFQiu https://t.co/y9Lvfm4Bho",GBHForumNetwork,['AI'],2235
2020-12-06 01:31:59,The Rise of Cloud Collaboration - Delivering Teams you can Count on https://t.co/irygbislIN by @uctodaynews #Cloud #Tech #Team,MyCloudIT_DaaS,"['Cloud', 'Tech', 'Team']",4034
2020-12-06 01:31:56,COVID-19 Update: Global Automotive Artificial Intelligence Market is Expected to Grow at a Healthy... https://t.co/xfLWyDBMfB #ai #ml #dl,AINewsFeed,"['ai', 'ml', 'dl']",6499
2020-12-06 01:31:56,A robot is now making Jamba smoothies in a California Walmart in less than 3 minutes | BusinessIns... https://t.co/SEE87MEzDK #ai #ml #dl,AINewsFeed,"['ai', 'ml', 'dl']",6499
2020-12-06 01:31:56,"Google fired an AI ethicist, and her former colleagues are up in arms https://t.co/Bc9ocl3qia #ai #ml #dl",AINewsFeed,"['ai', 'ml', 'dl']",6499
2020-12-06 01:31:50,"If there is one thing I will remember about 2020, it without question will be @IndianaFootball @IndianaTough @CoachAllenIU #LEO #coachoftheyear #team",IUMillersPacers,"['LEO', 'coachoftheyear', 'team']",242
2020-12-06 01:31:47,"IoT Software News &amp; more.. Aerospace software news, aircraft operations apps, IoT ... https://t.co/cHIaFNrkz8 #Software #IoT",software4iot,"['Software', 'IoT']",4461
2020-12-06 01:31:36,#USA: #Texas: Helpline for Asian Americans in Austin for #DV #sexual assault &amp; #trafficking: 877-281-8371,PixelProject,"['USA', 'Texas', 'DV', 'sexual', 'trafficking']",22049
2020-12-06 01:31:10,RoboDoc: how #India’s #robots are taking on Covid patient care https://t.co/x0pn7AVUo2 via @Guardian,EngrWorldHealth,"['India', 'robots']",1360
2020-12-06 01:31:03,"Amazon Transcribe streaming adds support for Japanese, Korean, and Brazilian Portuguese via @AWSCloud #AI #MachineLearning  https://t.co/vgggVi5NN8 https://t.co/vwzKlDVKGg",bernardleong,"['AI', 'MachineLearning']",6737
2020-12-06 01:30:57,#EthicalAI can be a potential minefield to navigate for even #AI leaders.. https://t.co/Wd6UIgOCOo,UnniSankar,"['EthicalAI', 'AI']",392
2020-12-06 01:30:38,"Fox was working on some lowers and was in the zone!! When he's got a welder in his hand, not many can go toe to toe with him. He truly is one of the best. #PRWChassis #Welding #Fabrication #Lowers #NASCAR #LateModel #Racing https://t.co/aeJAgH95eF",TheArrow_Z,"['PRWChassis', 'Welding', 'Fabrication', 'Lowers', 'NASCAR', 'LateModel', 'Racing']",289
2020-12-06 01:30:38,🔄 Prices update in $USD (1 hour):  $EOS   - 3.02 $      (+0.3 %)  $IOT    - 0.35 $      (+0.85 %) $ETC    - 6.22 $      (+0.19 %) $NEO   - 18.02 $     (+0.12 %) $DASH  - 104.13 $    (+0.56 %)  #USD #Dollar #EOS #IOT #ETC #NEO #DASH #Trading #Altcoins,cryptosUSD,"['USD', 'Dollar', 'EOS', 'IOT', 'ETC', 'NEO', 'DASH', 'Trading', 'Altcoins']",2666
2020-12-06 01:30:14,"#AI look at hourly charts #BTC  Over the last couple of bars on the one-hour chart, the price was moving up and down with no clear tendency. The recent up-move from the previous low at 18514.92 has brought the price...  Just choose your coin and be an expert! #crypto #trading https://t.co/cc470KH83Z",BalanceOt,"['AI', 'BTC', 'crypto', 'trading']",106
2020-12-06 01:30:08,“The future belongs to those who believe in the beauty of their dreams.” ~Eleanor Roosevelt https://t.co/QTrwhTRlo9  #QuotesThatInspire #Simerjeetsinghquotes #quotestoliveby #eleanorroosevelt #future #believeinyourdreams #believeinyourself #quotesoflife #Simerjeetsingh #Quotes https://t.co/U6UnGY1RZX,SimerjeetSingh,"['QuotesThatInspire', 'Simerjeetsinghquotes', 'quotestoliveby', 'eleanorroosevelt', 'future', 'believeinyourdreams', 'believeinyourself', 'quotesoflife', 'Simerjeetsingh', 'Quotes']",4654
2020-12-06 01:30:08,Hackers are going after COVID-19 vaccines rollout #blockchain #tech #technology #innovation #science #IT #BigData #Security https://t.co/sagadW7ucr https://t.co/ZlhwhuI5Nv,bitcoinagile,"['blockchain', 'tech', 'technology', 'innovation', 'science', 'IT', 'BigData', 'Security']",53941
2020-12-06 01:30:08,We are saddlers!!!  +INFO  https://t.co/zYQ8911WaO  D6 #equitación #sillasdemontar #guarnicionería #tradición #tecnología #equitation #saddles #saddlers #tradition #technology https://t.co/a0ZWa07z3Q,Zaldihipica,"['equitación', 'sillasdemontar', 'guarnicionería', 'tradición', 'tecnología', 'equitation', 'saddles', 'saddlers', 'tradition', 'technology']",29508
2020-12-06 01:30:06,Brain implant helps a blind woman regain her sight and play computer games #future #futurism #technology #innovation #leadership #education #entrepreneurship #management https://t.co/6hEuphphcP,311Institute,"['future', 'futurism', 'technology', 'innovation', 'leadership', 'education', 'entrepreneurship', 'management']",38925
2020-12-06 01:30:06,Top 20 #Predictions  Of How #AI Is Going To Improve #Cybersecurity In 2021  https://t.co/6zt7ZmA2qb #fintech #insurtech #insurance @LouisColumbus #ArtificialIntelligence #MachineLearning @Shirastweet @DimDrandakis @missdkingsbury @HaroldSinnott @ipfconline1 @andi_staub @SabineVdL https://t.co/1JZpJntCKX,SpirosMargaris,"['Predictions', 'AI', 'Cybersecurity', 'fintech', 'insurtech', 'insurance', 'ArtificialIntelligence', 'MachineLearning']",105117
2020-12-06 01:30:05,Cars &amp; Coffee [Middletown Car Meet]  S2:E16 Mils Garage #YouTube​ https://t.co/8fyrS18tKu #cars #jdm #r32 #nissan #subaru #american #camaro #delaware #automotive,jaymilnamow,"['YouTube', 'cars', 'jdm', 'r32', 'nissan', 'subaru', 'american', 'camaro', 'delaware', 'automotive']",312
2020-12-06 01:30:04,This is the enterprise digital testing quality funnel. » https://t.co/nDG12v1Vs4    #IoT #Futureofwork #BigData #AI #Digital #Cloud #Innovation,arjenvanberkum,"['IoT', 'Futureofwork', 'BigData', 'AI', 'Digital', 'Cloud', 'Innovation']",35846
2020-12-06 01:30:03,Date and time is: Sat 05 Dec 2020 08:30:03 PM EST and current memory usage is: 224.0M of 432.0M or 52.0% Powered by #RaspberryPi #Maker #IoT,gpibot_g,"['RaspberryPi', 'Maker', 'IoT']",66
2020-12-06 01:30:02,untitled https://t.co/dz7FqLApJt #tech #technology #blockchain #innovation #science #IT #BigData #Security #cybersecurity #crypto #cloud #IOT #computer #CISO #infosec #infosecurity #hacker #engineering,nTangledCloud,"['tech', 'technology', 'blockchain', 'innovation', 'science', 'IT', 'BigData', 'Security', 'cybersecurity', 'crypto', 'cloud', 'IOT', 'computer', 'CISO', 'infosec', 'infosecurity', 'hacker', 'engineering']",377
2020-12-06 01:30:00,Hats off to this large cruise ship that is maneuvering from the building hall to the dock. 🚢  🎥 YouTube / MeyerWerft #engineering https://t.co/6HfCsndZG1,IntEngineering,['engineering'],164058
2020-12-06 01:30:00,Must-have action special effects that designers can look at when they are not inspired!(2)#VR #AR #machinelearning #informationtechnology #DigitalTransformation #AI  #iot #mondaythoughts  #programming #science #robotic  #robotica #100DaysOfCode #100daysofcodechallenge https://t.co/nn3KAfvqW1,yywwy3,"['VR', 'AR', 'machinelearning', 'informationtechnology', 'DigitalTransformation', 'AI', 'iot', 'mondaythoughts', 'programming', 'science', 'robotic', 'robotica', '100DaysOfCode', '100daysofcodechallenge']",232
2020-12-06 01:29:21,Timnit Gebru's firing is concerning and calls into question Google's leadership in ethical #AI research within tech companies.  #AI4Good #CodedBias https://t.co/3igPAp0q1W,ShawnaButlerRN,"['AI', 'AI4Good', 'CodedBias']",1564
2020-12-06 01:29:14,Extremely creative way of explaining the concept!  See the whole thing @RSNA #RSNA20 Ethics of #AI in Radiology: Summary of the European and North American Multisociety Statement: RCC42 https://t.co/KwCHCXcfQ0,BFlanksteak,"['RSNA20', 'AI']",644
2020-12-06 01:29:08,"New Stock of the Day: $CIIC #SPAC Merging with #EV @arrival • @JimCramer Calls it ""Son of $TSLA "" 🔥 This caught fire Friday and could run more! https://t.co/g3cF32uzVr",RyanRozbiani,"['SPAC', 'EV']",1605
2020-12-06 01:29:07,Interesting... Amazon launches new AI services for DevOps and business intelligence applications - VentureBeat  #ai #ml #neuralnetworks #deeplearning #machinelearning  Read More Here: https://t.co/Td45XQn41f,cichuck,"['ai', 'ml', 'neuralnetworks', 'deeplearning', 'machinelearning']",9362
2020-12-06 01:28:38,Beautiful #Kalbarri . We ruined our weekend driving up in our #EV. #renewableenergy https://t.co/D4YODD4KnK,Jeannieic,"['Kalbarri', 'EV', 'renewableenergy']",1353
2020-12-06 01:28:32,Cylance brings AI and machine learning to anti-virus protection - Boing Boing https://t.co/YV3XCFJ5sN #machinelearning #ai #technology https://t.co/WaRVZ2ZIFJ,milocamj,"['machinelearning', 'ai', 'technology']",2559
2020-12-06 01:28:02,"Global IoT Security Market 2020 Analysis by Latest COVID19/CORONA Virus Impact with Market Positioning of Key Vendors: Symantec Corporation, McAfee, LLC, Cisco Systems, Inc, etc. | InForGrowth - Cheshire Media https://t.co/mKM3Q9zQRy #IoT #internetofthings #cybersecurity",Robotcybercrim1,"['IoT', 'internetofthings', 'cybersecurity']",182
2020-12-06 01:28:01,"'The number of recruiters who, according to Entelo, believe that they would be more productive with an entirely automated sourcing process is staggering. A full 80 % agreed...'  @Hubert_AI explores #AI in #HR  https://t.co/n4i1kvW2wy",darwincloak,"['AI', 'HR']",106
2020-12-06 01:27:30,"Hi dear, SCORE LIKE A GENIUS #essay due #Discussion  #Math #engineering mathematics #calculus I,II &amp; III #college algebra #Statistics  #anatomy  #chemistry  #physics #Biology  #economics #Accounting  exam, assignment. homework, quiz and tests. DM @legitwriters_10",legitwriters_10,"['essay', 'Discussion', 'Math', 'engineering', 'calculus', 'college', 'Statistics', 'anatomy', 'chemistry', 'physics', 'Biology', 'economics', 'Accounting']",44
2020-12-06 01:27:10,WOW!  THE SHOCKING PITFALLS of ELK — Watch the #1 break-down of an installation and the costs associated w/ setting up your own #Elastic #Logstash #Kibana cluster: https://t.co/BE0mou84W0  —  #logmanagment #BigData #Breach #Data #DataAnalysis #AI #SIEM #networkengineer #security,LogZilla,"['Elastic', 'Logstash', 'Kibana', 'logmanagment', 'BigData', 'Breach', 'Data', 'DataAnalysis', 'AI', 'SIEM', 'networkengineer', 'security']",841
2020-12-06 01:27:05,perfect Christmas gift #artist #sketch #drawing #trucks #cars https://t.co/rPPu1WWFZe,GpuccG,"['artist', 'sketch', 'drawing', 'trucks', 'cars']",71
2020-12-06 01:27:03,"""I really felt like Sabio cared about me as an individual and was going to do everything they could to help me succeed."" - Anna, Sabio Alumnus &amp; Full Stack Developer   ➡️https://t.co/n0keUkWbyk  #WomenInTech #Technology #Coder #WebDesign #WorkHard #CodingLife #WebDev #Job https://t.co/7YB0NGqUm2",WeSabio,"['WomenInTech', 'Technology', 'Coder', 'WebDesign', 'WorkHard', 'CodingLife', 'WebDev', 'Job']",3108
2020-12-06 01:27:02,"#OpenBanking platforms are growing around the world.  Globally, there was a 269% annual #growth rate in open #banking #platforms with a massive upswing in #API products being made available   https://t.co/ksUI5j6v87  #technology #regulation #innovation #strategy #FinTech @Axway https://t.co/Xe7bCeiKHn",davidjmaireles,"['OpenBanking', 'growth', 'banking', 'platforms', 'API', 'technology', 'regulation', 'innovation', 'strategy', 'FinTech']",6244
2020-12-06 01:27:01,Deploy an instance in just seconds with Vultr - Get $100 to test - https://t.co/WYtMkX6DaZ #techlife #TechNews #Technology #technologynews #servers #hosting #freelance #webdev #webdeveloper #minecraftserver,MImproxyble,"['techlife', 'TechNews', 'Technology', 'technologynews', 'servers', 'hosting', 'freelance', 'webdev', 'webdeveloper', 'minecraftserver']",3637
2020-12-06 01:26:39,Get recipe from photos. Almost there now #AI is mastering humans now. Question to ask is what will humans do in future. https://t.co/Me1fdLOXAB,Virender_VA,['AI'],3775
2020-12-06 01:26:39,Can you imagine anything more soulless than a car that is designed as an appliance from the beginning. this has to be a joke or a scam to get government subsidies and leave. ⚡️🚗 $CNOO $HCAC #electric #StocksToWatch #StockMarket  https://t.co/7a2es2a9Vs,silberschmelzer,"['electric', 'StocksToWatch', 'StockMarket']",932
2020-12-06 01:26:13,Open Access articles reach broader audiences than articles in non-Open Access journals. #hostingconference #linkedin #html #technology #scienchar #researchers https://t.co/7c2S4rdhoZ,kpgroup17,"['hostingconference', 'linkedin', 'html', 'technology', 'scienchar', 'researchers']",24
2020-12-06 01:26:09,This self-closing protective flood system saves lives and protects infrastructure. 🤩 #engineering   https://t.co/W0dmR5SCWY,Sefenizkapri,['engineering'],714
2020-12-06 01:24:33,Executive Order on Promoting the Use of Trustworthy Artificial Intelligence in the Federal Government https://t.co/SoPDzf3afk #ai,nickj2k,['ai'],39
2020-12-06 01:24:32,"The latest Read, share, geek out!  @nickJ2k! https://t.co/ksDr0JSu3Z Thanks to @worldbmf #ai #tech",nickj2k,"['ai', 'tech']",39
2020-12-06 01:24:26,"3 WINNER #Giveaway! #WIN a @kidsbrightoys #Electric #Balloon Pump Kit! Includes tons of #balloons, #ribbons and more! Make a #balloonarch for a #party! #Birthday #Wedding #BabyShower #celebration #Free #Contest @Love_MrsMommy https://t.co/UWvdMgUz6Y https://t.co/QzWuL3enAh",sgrm9514,"['Giveaway', 'WIN', 'Electric', 'Balloon', 'balloons', 'ribbons', 'balloonarch', 'party', 'Birthday', 'Wedding', 'BabyShower', 'celebration', 'Free', 'Contest']",808
2020-12-06 01:24:16,"Raspberry Pi 4 Available in 2, 4, and 8 GB Options  #iot #Maker #RaspberryPi4 #IoT https://t.co/KVQZ6Dm37W",BuildIoT,"['iot', 'Maker', 'RaspberryPi4', 'IoT']",305
2020-12-06 01:24:11,See your #BrowserInfo #AgentString! Use #NetworkTools #SEOTools to see your #browser #OS #AgengUserString! #SEO #search #TechBlog #technology #freeSEOtools #freesoftware https://t.co/sfQ5wJB8k3,DexLinxListing,"['BrowserInfo', 'AgentString', 'NetworkTools', 'SEOTools', 'browser', 'OS', 'AgengUserString', 'SEO', 'search', 'TechBlog', 'technology', 'freeSEOtools', 'freesoftware']",5197
2020-12-06 01:24:04,IoT ecosystems that stitch together sensor-based data with legacy systems and newer technologies hold tremendous promise for those engaged in moving goods. Link &gt;&gt; https://t.co/mZjFLOHZsv @DeloitteInsight @antgrasso via @LindaGrass0 #CloudComputing #AI #IoT #Tech https://t.co/rvi70qnhyX,CsuiteTechPoint,"['CloudComputing', 'AI', 'IoT', 'Tech']",7266
2020-12-06 01:23:59,The Algorithm Design Manual (Texts in Computer Science)   Link - https://t.co/5akoroUlw6  #Mathematics #math #100DaysOfCode #CodeNewbies #WomenWhoCode #Algorithms #DeepLearning #AI #ArtificialIntelligence #MachineLearning #ML #programming,rasangarocks,"['Mathematics', 'math', '100DaysOfCode', 'CodeNewbies', 'WomenWhoCode', 'Algorithms', 'DeepLearning', 'AI', 'ArtificialIntelligence', 'MachineLearning', 'ML', 'programming']",50861
2020-12-06 01:23:42,It’s up to us to make leadership happen. What’s your plan? https://t.co/hIxIGZ33bU #Leadership #motivation #management #coach #WritingCommunity #speaker #mentor #leadershiptraining #teambuilding #motivationquotes #InspirationalQuotes #HR #author #collaboration #businesstips #team https://t.co/VHojYirIzh,RyanGausman,"['Leadership', 'motivation', 'management', 'coach', 'WritingCommunity', 'speaker', 'mentor', 'leadershiptraining', 'teambuilding', 'motivationquotes', 'InspirationalQuotes', 'HR', 'author', 'collaboration', 'businesstips', 'team']",0
2020-12-06 01:23:35,[Job] Need Electrical Engineering Technician | Company: Solar Power Nation Pty Ltd | Location: Wetherill Park NSW New South Wales Australia | #Wetherill #Park #Electronic #Engineering #Jobs | More info at  https://t.co/VewvJFoQSp,EngineersDay,"['Wetherill', 'Park', 'Electronic', 'Engineering', 'Jobs']",16143
2020-12-06 01:23:18,"Want to land a job like ""Ingénieur(e) maintenance fiabilité"" at Alcoa? Applicant tracking systems look for specific keywords. Use the right keywords and get your resume in front of the hiring manager. #Engineering #Deschambault, QC",tmj_CAN_eng,"['Engineering', 'Deschambault']",213
2020-12-06 01:23:17,[Job] Executive Assistant (Ongoing) | Company: Queanbeyan-Palerang Regional Council | Location: Queanbeyan NSW New South Wales Australia | #Queanbeyan #Electronic #Engineering #Jobs | More info at  https://t.co/iNgDk0SKxm,EngineersDay,"['Queanbeyan', 'Electronic', 'Engineering', 'Jobs']",16143
2020-12-06 01:23:02,[Job] Graduate Electrical/Electronic Engineer | Company: Raytheon Intelligence &amp; Space | Location: Nowra NSW New South Wales Australia | #Nowra #Electronic #Engineering #Jobs | More info at  https://t.co/9pYL49JAwR,EngineersDay,"['Nowra', 'Electronic', 'Engineering', 'Jobs']",16143
2020-12-06 01:23:00,See how autonomous vehicles can achieve pixel-perfect perception with panoptic segmentation - via @nvidiadrive   Read/Add #SelfDrivingCars news https://t.co/bpSD60w38Y  #driverlesscars #autonomouscars #autonomousvehicles  #machinelearning #deeplearning #ml #dl #computervision https://t.co/sFJixcVYpX,selfdriving360,"['SelfDrivingCars', 'driverlesscars', 'autonomouscars', 'autonomousvehicles', 'machinelearning', 'deeplearning', 'ml', 'dl', 'computervision']",2289
2020-12-06 01:22:48,"If jobs with titles like ""Engineer II, QA"" sound appealing to you, follow us to hear about these types of opportunities in #Pleasanton, CA. #Engineering",tmj_sfo_eng,"['Pleasanton', 'Engineering']",414
2020-12-06 01:22:43,[Job] Electrical/Electronic Engineer | Company: Gammasonics Institute for Medical Research Pty Ltd. | Location: Lane Cove NSW New South Wales Australia | #Lane #Cove #Electronic #Engineering #Jobs | More info at  https://t.co/1FDcOA3hIi,EngineersDay,"['Lane', 'Cove', 'Electronic', 'Engineering', 'Jobs']",16143
2020-12-06 01:22:41,Enter for a chance to win a custom ORIGIN PC GENESIS gaming desktop! Giveaway is open to fifty (50) United States #prize #sweepstakes #sweeps #giveaway #free #winprizes #gaming #technology #pcgaming #esports #geek  ⬇️CLICK BELOW TO ENTER &amp; SEE PRIZES⬇️  https://t.co/XBNZJs9wrQ,ContestCrazy305,"['prize', 'sweepstakes', 'sweeps', 'giveaway', 'free', 'winprizes', 'gaming', 'technology', 'pcgaming', 'esports', 'geek']",223
2020-12-06 01:22:28,"eclecticbeams: ""Labrynth City Nights, Part 1"", written by AI at Eclectic Beams https://t.co/FIUfsl1bYG #ML #AI #GPT #NLP #machinelearning  “I have no interest in it.” Kirin said to Jake before looking around the kitchen island. “Listen,” he continued. “The only place a detectiv…",jakob_anderson,"['ML', 'AI', 'GPT', 'NLP', 'machinelearning']",309
2020-12-06 01:22:20,[Job] Production/ Electronics Assistant | Company: ENTTEC | Location: Keysborough VIC Victoria Australia | #Keysborough #Electronic #Engineering #Jobs | More info at  https://t.co/TtgVdPiLQi,EngineersDay,"['Keysborough', 'Electronic', 'Engineering', 'Jobs']",16143
2020-12-06 01:22:00,"""Labrynth City Nights, Part 1"", written by AI at Eclectic Beams https://t.co/mAW9CAvBj8 #ML #AI #GPT #NLP #machinelearning  “I have no interest in it.” Kirin said to Jake before looking around the kitchen island. “Listen,” he continued. “The only place a detective would go look…",eclecticbeams,"['ML', 'AI', 'GPT', 'NLP', 'machinelearning']",2
2020-12-06 01:22:00,[Job] Electronic Assembler | Company: ISSATEC ENGINEERING | Location: Granville NSW New South Wales Australia | #Granville #Electronic #Engineering #Jobs | More info at  https://t.co/J5MmlmR2s7,EngineersDay,"['Granville', 'Electronic', 'Engineering', 'Jobs']",16143
2020-12-06 01:22:00,The #Engineering @GroupHipe worked hard all year...so we decided to play with a drone to finish the semester. All tired but managed to smile. Congratulation to @purveshsharma93 @islam_shafinaz @Sazida_B_Islam &amp; Rezwan in defending! #research #HPC #MachineLearning #embedded #TXST https://t.co/Aquon3ICkg,GroupHipe,"['Engineering', 'research', 'HPC', 'MachineLearning', 'embedded', 'TXST']",27
2020-12-06 01:21:46,[Job] Electronic Engineer | Company: Hayes Spraying | Location: Goondiwindi QLD Queensland Australia | #Goondiwindi #Electronic #Engineering #Jobs | More info at  https://t.co/cfNMd8wtQF,EngineersDay,"['Goondiwindi', 'Electronic', 'Engineering', 'Jobs']",16143
2020-12-06 01:21:34,[Job] Graduate Design Engineers | Company: Applidyne | Location: Brompton SA South Australia Australia | #Brompton #Electronic #Engineering #Jobs | More info at  https://t.co/P6u5sn0nXt,EngineersDay,"['Brompton', 'Electronic', 'Engineering', 'Jobs']",16143
2020-12-06 01:21:30,[Job] Electronic Design Internships | Company: Applidyne | Location: Brompton SA South Australia Australia | #Brompton #Electronic #Engineering #Jobs | More info at  https://t.co/0ph7yaduPX,EngineersDay,"['Brompton', 'Electronic', 'Engineering', 'Jobs']",16143
2020-12-06 01:21:29,The latest Supply Chain Management Daily! https://t.co/txGqZXkqHE Thanks to @sfbaycalifornia @melissaterras @Webmoblink #supplychain #technology,pieternagel,"['supplychain', 'technology']",84
2020-12-06 01:21:26,[Job] Electronics Engineering Technician | Company: Sydney Hoist &amp; Scaffolding Pty Ltd | Location: Blacktown NSW New South Wales Australia | #Blacktown #Electronic #Engineering #Jobs | More info at  https://t.co/3En2B4DNgd,EngineersDay,"['Blacktown', 'Electronic', 'Engineering', 'Jobs']",16143
2020-12-06 01:21:20,Advanced Artificial Intelligence Adopters Attributed 12% Points of Revenue Gain Directly to AI Integrations: Report   READ MORE: https://t.co/2JouZ98Xvw  #AI #DeepLearning #MachineIntelligence #MachineLearning #MixedLearning #SmartDevices https://t.co/l4YfKfjd2t,IAM__Network,"['AI', 'DeepLearning', 'MachineIntelligence', 'MachineLearning', 'MixedLearning', 'SmartDevices']",17989
2020-12-06 01:21:07,"Using #Drones, #AI And #BigData, India To Draw Up #Digital Map With 10 cms Resolution by @PTI_News @TheWeekLive  Read more https://t.co/uCiVINXgIt  #MachineLearning #ArtificialIntelligence #ML #MI #DataScience #Analytics  Cc: @kirkdborne @rudyagovic @loomiassistant https://t.co/OlF3HO49IF",Ronald_vanLoon,"['Drones', 'AI', 'BigData', 'Digital', 'MachineLearning', 'ArtificialIntelligence', 'ML', 'MI', 'DataScience', 'Analytics']",236227
2020-12-06 01:21:04,"Motorsport is back in Victoria! A long queue of transporters assembled outside @PICircuit for testing last Thursday, including the Renault Sport @GRMotorsport B-Double. Who's excited to be trackside in 2021? #motorsport #transporter #BDouble https://t.co/RwPXY9qQQQ",TrucksatTracks,"['motorsport', 'transporter', 'BDouble']",467
2020-12-06 01:20:26,The future of ride hailing powered by #Robotaxis.   #AI #robotic #robot #AutonomousVehicles #selfdrivingcars #selfDrivingCar #tesla #uber #IOT https://t.co/GNWCzBR6XX,alvinfoo,"['Robotaxis', 'AI', 'robotic', 'robot', 'AutonomousVehicles', 'selfdrivingcars', 'selfDrivingCar', 'tesla', 'uber', 'IOT']",60021
2020-12-06 01:20:22,Apple has some big news December 8 #design #coding #programming #software #gaming #geek #iPhone #AppleMusic #Technology #Apple https://t.co/qOLu9QR9hM,JonathanDylla,"['design', 'coding', 'programming', 'software', 'gaming', 'geek', 'iPhone', 'AppleMusic', 'Technology', 'Apple']",286
2020-12-06 01:20:18,2 Pcs Cat Eyes Vinyl Car Stickers Set #speed #racing https://t.co/fekiSK229A,BestCarsStuff,"['speed', 'racing']",96
2020-12-06 01:20:15,"Weather at Fort Meade / Tipton, MD - via NOAA's National Weather Service Conditions: Mostly Cloudy Barometer: 29.93 in (1013.4 mb) Temperature: 42° Winds: Northwest at 6.9 MPH (6 KT)  Powered by #RaspberryPi #IoT #Maker",gpibot_g,"['RaspberryPi', 'IoT', 'Maker']",66
